Name,Type of Agency,Tagline,Ratings,Reviews,Sponsor,MinProjectSize,HourlyRate,TeamSize,Location,ServiceNames,ServicePercentages,Feedback,WebsiteLink,ClutchDirectoryLink
Background Removal Services,Logo Designers,"Clipping path, Photo Editing, Photo Retouch $0.50",5.0,1 REVIEW,No,"$50,000+",$50 - $99 / hr,250 - 999,"Dhaka, Bangladesh","Logo,Graphic Design,Print Design,Product Design,Architectural Design,UX/UI Design","30,35,15,10,5,5",Background Removal Services is founded with the ambition of being the best to provide a quality service relating to image editing and retouching. We're dedicated to providing you the very best of…,,https://clutch.co/profile/background-removal-services
Omit Studios,Logo Designers,Elevating the authentic,5.0,10 REVIEWS,No,"$10,000+",$150 - $199 / hr,2 - 9,"Boca Raton, FL","Logo,Print Design,Graphic Design,Packaging Design,UX/UI Design,Web Design","20,30,20,10,10,10","""Their attention to detail made it easier to work through issues in a timely manner.""",,https://clutch.co/profile/omit-studios
Resound,Logo Designers,You are remarkable,4.9,12 REVIEWS,No,"$10,000+",$150 - $199 / hr,10 - 49,"Tempe, AZ","Logo,Branding,Content Marketing,Video Production,Web Design,Web Development","20,45,10,10,10,5",“Their creativity is amazing — Resound’s branding ideas have been so interesting and fresh.”,,https://clutch.co/profile/resound
Atelier LKS,Logo Designers,Orchestrating brand harmony for your business,5.0,7 REVIEWS,No,"$5,000+",$150 - $199 / hr,2 - 9,"Providence, RI","Logo,Branding,Graphic Design,Web Design","20,40,20,20","""Atelier LKS was responsive and thorough, and they worked hard to meet our needs.""",,https://clutch.co/profile/atelier-lks
Eleven,Logo Designers,"Brand creative, D2C Shopify e-commerce agency.",5.0,11 REVIEWS,No,"$5,000+",Undisclosed,2 - 9,"London, United Kingdom","Logo,UX/UI Design,Web Design,Branding,Graphic Design,Conversion Optimization,Digital Strategy,E-Commerce Development,Social Media Marketing,Web Development","10,20,20,15,10,5,5,5,5,5","""The only thing I want to do differently is work with Eleven more!""",,https://clutch.co/profile/eleven-1
PNC Logos,Logo Designers,PNC Logos,5.0,6 REVIEWS,No,"$1,000+",$50 - $99 / hr,50 - 249,"Orlando, FL","Logo,E-Commerce Development,Pay Per Click,Print Design,Search Engine Optimization,Social Media Marketing,Web Design,Web Development","16,12,12,12,12,12,12,12","""Their attention to detail and willingness to please me as the client seemed to always be their primary objective.""",,https://clutch.co/profile/pnc-logos
Homepage,Logo Designers,Creative.Digital.Agency,5.0,11 REVIEWS,No,"$5,000+",$25 - $49 / hr,10 - 49,"Novi Sad, Serbia","Logo,Digital Strategy,Pay Per Click,Branding","20,40,25,15","""After two years of fruitful cooperation, I can confidently say they can successfully complete any assigned project.""",,https://clutch.co/profile/homepage
BrandLink Advisors,Logo Designers,"Counsel, advice, answers on Branding and Identity",5.0,8 REVIEWS,No,"$5,000+",$200 - $300 / hr,2 - 9,"New York, NY","Logo,Branding,Graphic Design","25,50,25","""The team at BrandLink Advisors has the right creative skillset for branding work.""",,https://clutch.co/profile/brandlink-advisors
Visceral,Logo Designers,Craft with Purpose,5.0,18 REVIEWS,No,"$50,000+",$200 - $300 / hr,2 - 9,"San Diego, CA","Logo,Branding,Web Design,Web Development,UX/UI Design,Digital Strategy","10,25,20,20,15,10","""Everyone had such a positive attitude, even when dealing with difficult requests.""",,https://clutch.co/profile/visceral
Kukoo Creative,Logo Designers,Small business brand design experts,5.0,1 REVIEW,No,Undisclosed,$50 - $99 / hr,2 - 9,"Garforth, United Kingdom","Logo,Branding,Web Design,Print Design,Other Design","35,25,25,10,5","""Their creativity is incredible, and none of this has felt like hard work.""",,https://clutch.co/profile/kukoo-creative
Brainbox Design,Logo Designers,"Branding, web and UI/UX design agency",5.0,33 REVIEWS,No,"$5,000+",$50 - $99 / hr,10 - 49,"Glendale, CA","Logo,Web Design,UX/UI Design","20,50,30","""Their delivery was mind-blowing.""",,https://clutch.co/profile/brainbox-design
Silk Studio,Logo Designers,Start with Silk.,5.0,8 REVIEWS,No,"$25,000+",$150 - $199 / hr,2 - 9,"Marina del Rey, CA","Logo,Branding,Graphic Design,Out of Home Design,Packaging Design,Print Design","20,40,10,10,10,10","""We’re very happy with what Silk Studio created. We’ve received a lot of positive feedback on the design.""",,https://clutch.co/profile/silk-studio
Lime&Co,Logo Designers,Cultivating brands. Rooted in clarity.,5.0,1 REVIEW,No,"$10,000+",$150 - $199 / hr,2 - 9,"San Diego, CA","Logo,Branding,Web Design,Print Design","30,35,25,10","""Their team made it into an experience we truly enjoyed from day one.""",,https://clutch.co/profile/limeco
KVikStudio,Logo Designers,We create content for businesses and NGOs,4.9,13 REVIEWS,No,"$1,000+",$25 - $49 / hr,10 - 49,"Kyiv, Ukraine","Logo,Web Design,Content Marketing,Graphic Design,Social Media Marketing,Web Development","15,25,15,15,15,15","""They were able to help with the complete cycle of content and website creation.""",,https://clutch.co/profile/kvikstudio
Ingenious Guru NYC,Logo Designers,Trusted Digital Marketing Agency,5.0,5 REVIEWS,No,"$1,000+",$50 - $99 / hr,10 - 49,"Huntington Station, NY","Logo,Web Development","50,50","""Everything has been handled really well.""",,https://clutch.co/profile/ingenious-guru-nyc
Creative Chameleon Studio,Logo Designers,Crafting strategy & design for growing businesses,5.0,4 REVIEWS,No,"$5,000+",$150 - $199 / hr,Freelancer,"Columbia Station, OH","Logo,Branding,Graphic Design","45,45,10","""Creative Chameleon Studio consistently met or exceeded our timelines.""",,https://clutch.co/profile/creative-chameleon-studio
Aeolidia,Logo Designers,Shopify Design & Branding For Creative Businesses,4.9,18 REVIEWS,No,"$10,000+",$200 - $300 / hr,10 - 49,"Seattle, WA","Logo,Web Design,E-Commerce Development","25,50,25","""The quality of work was excellent; I am very happy with my site.""",,https://clutch.co/profile/aeolidia
Woland Web,Logo Designers,Turning Website Woes into Website WOWs,5.0,1 REVIEW,No,"$5,000+",$100 - $149 / hr,2 - 9,"Charlotte, NC","Logo,Web Design,Web Development,Graphic Design,Print Design,Branding,Email Marketing","10,30,30,10,10,5,5","""I highly recommend this company if you are looking to design a new website.""",,https://clutch.co/profile/woland-web
3rd Edge,Logo Designers,Strategic Design for Mission-Driven Organizations,5.0,2 REVIEWS,No,"$25,000+",$150 - $199 / hr,2 - 9,"New York, NY","Logo,UX/UI Design,Web Design,Web Development,Branding,Digital Strategy,Graphic Design","10,20,20,20,10,10,10","""They cater to the needs of our nonprofit, and they know our values and goals.""",,https://clutch.co/profile/3rd-edge
hello.,Logo Designers,Helping you make a difference,5.0,10 REVIEWS,No,"$25,000+",$100 - $149 / hr,10 - 49,"Tel Aviv-Yafo, Israel","Logo,Branding,Web Design,UX/UI Design","15,50,20,15","“We’ve worked with hello. for over a year, and we’re very happy with our engagement — we’ll continue to work with them.”",,https://clutch.co/profile/hello
Oxide Design Co.,Logo Designers,Craft branding and design,5.0,1 REVIEW,No,"$5,000+",$150 - $199 / hr,2 - 9,"Omaha, NE","Logo,Branding,Packaging Design,Web Design,Graphic Design,Print Design,UX/UI Design","25,25,25,10,5,5,5","""Their team excels at collaborating and brainstorming ideas with us.""",,https://clutch.co/profile/oxide-design-co
Heraldist,Logo Designers,Dreamers. Makers. Troublemakers.,4.9,9 REVIEWS,No,"$10,000+",$100 - $149 / hr,10 - 49,"San Francisco, CA","Logo,Branding,Marketing Strategy,Advertising,Video Production","10,50,20,10,10","""I felt their great commitment, good know-how, and clarity in terms of brand strategy.""",,https://clutch.co/profile/heraldist
Lofty Word,Logo Designers,Providing clarity and confidence for your brand.,5.0,7 REVIEWS,No,"$10,000+",$150 - $199 / hr,2 - 9,"Orangevale, CA","Logo,Branding,UX/UI Design,Web Design","20,40,20,20",“Lofty Word was extremely detail-oriented.”,,https://clutch.co/profile/lofty-word
Petrikor Solutions,Logo Designers,Petrikor Solutions Creative Digital Marketing,4.9,4 REVIEWS,No,"$1,000+",$25 - $49 / hr,10 - 49,"Abu Dhabi, United Arab Emirates","Logo,Branding,Content Marketing,Graphic Design,Mobile & App Marketing,Other Digital Marketing,Pay Per Click,Search Engine Optimization,Social Media Marketing,Web Design","10,10,10,10,10,10,10,10,10,10","""They've brought creative solutions to the table and helped us realize our goals when we've had nothing to start with.""",,https://clutch.co/profile/petrikor-solutions
crowdspring,Logo Designers,Design Done Better.,5.0,3 REVIEWS,No,Undisclosed,Undisclosed,10 - 49,"Chicago, IL","Logo,Branding,Packaging Design,Product Design,Web Design","30,30,20,10,10","""The graphic designers were great to work with and very receptive to making changes.""",,https://clutch.co/profile/crowdspring
WebWorld Experts,Logo Designers,Driving Digital Performance.,5.0,1 REVIEW,No,"$1,000+",< $25 / hr,250 - 999,"Panchkula, India","Logo,Branding,E-Commerce Development,Web Design,Web Development,UX/UI Design","10,20,20,20,20,10","""The team made sure that my website would not be another cookie-cutter page."" """,,https://clutch.co/profile/webworld-experts
visux.net,Logo Designers,We build digital products,5.0,17 REVIEWS,No,"$5,000+",$50 - $99 / hr,10 - 49,"Warszawa, Poland","Logo,Product Design,UX/UI Design,Web Design","10,40,40,10","""They were willing to really understand the needs of the client.""",,https://clutch.co/profile/visuxnet
JVM Design,Logo Designers,"We don't just have clients, we have fans.",5.0,23 REVIEWS,No,"$5,000+",$150 - $199 / hr,2 - 9,"Roseburg, OR","Logo,Web Design,Graphic Design,Print Design,Web Development","10,60,10,10,10","""JVM Design helped develop an entirely new look, feel, and flow for the site.""",,https://clutch.co/profile/jvm-design
INCITRIO > B2B digital marketing agency in SoCal,Logo Designers,Start Fresh | Growing Brands since 2004,4.8,16 REVIEWS,No,"$1,000+",$150 - $199 / hr,10 - 49,"Vista, CA","Logo,Branding,Digital Strategy,Web Design","10,40,30,20","""They were an exceptional company.""",,https://clutch.co/profile/incitrio-b2b-digital-marketing-agency-socal
smallnormous,Logo Designers,Take your business from small to smallnormous,5.0,7 REVIEWS,No,"$1,000+",$100 - $149 / hr,2 - 9,"Santa Rosa, CA","Logo,Branding,Web Design,Social Media Marketing","20,40,35,5","“They’re brilliant creative minds who are also diligent, dedicated, and personable.”",,https://clutch.co/profile/smallnormous
Vince Logo Design,Logo Designers,Empower Your Imagination!,5.0,4 REVIEWS,No,"$1,000+",$25 - $49 / hr,50 - 249,"San Diego, CA","Logo,Branding,Web Development,E-Commerce Development,Mobile App Development,Search Engine Optimization,Video Production","15,20,20,15,15,10,5","""They were very professional and quick to deliver the final items.""",,https://clutch.co/profile/vince-logo-design
Luminary Brands,Logo Designers,"Bespoke Branding, Web Design & Digital Marketing ✅",5.0,10 REVIEWS,No,"$5,000+",$50 - $99 / hr,10 - 49,"London, United Kingdom","Logo,Branding,Web Design,Digital Strategy,Advertising,Social Media Marketing","10,35,20,15,10,10","""The overall quality of their work was outstanding.""",,https://clutch.co/profile/luminary-brands
PLAYBOOK STUDIO,Logo Designers,Sharp Strategies. Beautifully Executed.,4.8,3 REVIEWS,No,"$75,000+",$200 - $300 / hr,2 - 9,"Chicago, IL","Logo,Branding,Advertising,Market Research,Business Consulting,Web Design","20,45,15,10,5,5","''Their leadership, intelligence, and verve are unique.''",,https://clutch.co/profile/studio-17
Little Guy Branding,Logo Designers,A little Help Goes A Long Way.,5.0,3 REVIEWS,No,"$1,000+",$100 - $149 / hr,2 - 9,"Ralston, NE","Logo,Branding,Graphic Design,Search Engine Optimization,Video Production,Web Design,Web Development,Business Consulting,Content Marketing,E-Commerce Development,Public Relations,Social Media Marketing","10,15,10,10,10,10,10,5,5,5,5,5",“I've worked with a lot of different providers but now I won't use anybody other than Little Guy Design.”,,https://clutch.co/profile/little-guy-branding
Murmur Creative,Logo Designers,Branding with Heart,4.9,13 REVIEWS,No,"$25,000+",$150 - $199 / hr,10 - 49,"Portland, OR","Logo,Branding,Packaging Design,Web Design,Print Design,Web Development,Corporate Photography","10,25,20,20,10,10,5","""The whole operation just exuded professionalism, though everybody was extremely friendly.""",,https://clutch.co/profile/murmur-creative
Candybox Marketing,Logo Designers,Marketing Made Sweet,4.9,4 REVIEWS,No,"$1,000+",$100 - $149 / hr,10 - 49,"Mississauga, Canada","Logo,Pay Per Click,Social Media Marketing,Video Production,Web Design","20,20,20,20,20","""Their team is very professional and wants me to succeed.""",,https://clutch.co/profile/candybox-marketing
ano.digital - Product Design Agency,Logo Designers,Improving Businesses' Growth with UI/UX,5.0,1 REVIEW,No,"$10,000+",$50 - $99 / hr,10 - 49,"Tallinn, Estonia","Logo,UX/UI Design,Web Design,Digital Strategy,Graphic Design,Mobile App Development,Web Development","10,30,20,10,10,10,10","""The workflow established between our teams and ano.digital was nothing short of remarkable.""",,https://clutch.co/profile/anodigital-product-design-agency
Epic Sofia,Logo Designers,Epic Results,5.0,4 REVIEWS,No,"$1,000+",$25 - $49 / hr,2 - 9,"Sofia, Bulgaria","Logo,UX/UI Design,Web Design,Mobile & App Marketing,Social Media Marketing","30,30,20,10,10","""The first designs were very high quality — they showed that they understood us and our mission from the start.""",,https://clutch.co/profile/epic-sofia
Logo.com,Logo Designers,The first step to building a beautiful brand,5.0,1 REVIEW,No,"$1,000+",< $25 / hr,2 - 9,"Vancouver, Canada",Logo,100,"""I am very happy with the LOGO service, it is both personal and professional.""",,https://clutch.co/profile/logocom
iTechnolabs Inc,Logo Designers,Bring Your Innovative Idea into Reality,5.0,4 REVIEWS,No,"$1,000+",< $25 / hr,50 - 249,"Markham, Canada","Logo,Mobile App Development,AI Development,Web Development,E-Commerce Development,UX/UI Design","10,30,20,20,10,10","""The outcome has been fabulous.""",,https://clutch.co/profile/itechnolabs
OAX STUDIO,Logo Designers,WE ARE BRAND ARCHITECTS.,5.0,3 REVIEWS,No,"$10,000+",$100 - $149 / hr,2 - 9,"New York, NY","Logo,Branding,Graphic Design,Packaging Design,Product Design","20,20,20,20,20","""They make everything more simplistic and provide us with enough variety to understand what will and will not work out.""",,https://clutch.co/profile/oax-studio
Manifiesto,Logo Designers,We shape the invisible,5.0,9 REVIEWS,No,"$1,000+",$50 - $99 / hr,2 - 9,"Ciudad de México, Mexico","Logo,Branding,Packaging Design,Graphic Design,Web Design","20,40,25,10,5","""They've delivered everything on time and way above expectations.""",,https://clutch.co/profile/manifiesto-0
Pithy Studios,Logo Designers,Recognised by Clutch as a Top UK Logo Designer,5.0,16 REVIEWS,No,"$1,000+",$100 - $149 / hr,2 - 9,"London, United Kingdom","Logo,Branding,Graphic Design,Social Media Marketing","25,45,20,10","""Their execution was excellent.""",,https://clutch.co/profile/pithy-studios
YellowDog Denver,Logo Designers,Design | Print | Marketing,5.0,9 REVIEWS,No,Undisclosed,$100 - $149 / hr,10 - 49,"Denver, CO","Logo,Print Design,Graphic Design,Branding,Web Design","10,50,20,10,10","""They took projects seriously and provided lots of thoughtful insights.""",,https://clutch.co/profile/yellowdog-denver
Tielemans Design,Logo Designers,Logo and Branding Design,5.0,4 REVIEWS,No,"$5,000+",$100 - $149 / hr,2 - 9,"Henderson, NV","Logo,Graphic Design,Packaging Design","50,25,25","""Their confidence and professionalism were exceptional.""",,https://clutch.co/profile/tielemans-design
Hansen Belyea,Logo Designers,Brand / Video / Web,5.0,3 REVIEWS,No,"$10,000+",$150 - $199 / hr,2 - 9,"Seattle, WA","Logo,Branding,Web Design,Video Production","20,40,30,10","""Aside from the quality of their work, they're also extremely transparent and easy to work with.""",,https://clutch.co/profile/hansen-belyea
Rebell Studio,Logo Designers,"BRANDING, COMMUNICATION STRATEGY, PRODUCTION HOUSE",5.0,5 REVIEWS,No,"$1,000+",$50 - $99 / hr,10 - 49,"Poznań, Poland","Logo,Advertising,Branding,Corporate Photography,Graphic Design,Marketing Strategy,Packaging Design,Print Design,Video Production","10,20,10,10,10,10,10,10,10","""They were hardworking, responsive, available at all hours, energetic, agreeable, pleasant, diligent, and creative.""",,https://clutch.co/profile/rebell-studio
BSTRO,Logo Designers,Design For Engagement,4.9,5 REVIEWS,No,"$10,000+",$150 - $199 / hr,10 - 49,"San Francisco, CA","Logo,Branding,Digital Strategy,UX/UI Design,Web Development","20,20,20,20,20","""The BSTRO team members are thought leaders when it comes to digital marketing.""",,https://clutch.co/profile/bstro
Evergreen Design Studio,Logo Designers,I create kick-ass brands and websites,5.0,4 REVIEWS,No,"$1,000+",$150 - $199 / hr,2 - 9,"Denver, CO","Logo,Graphic Design,Event Marketing & Planning,Packaging Design,Print Design,Search Engine Optimization,Web Design","10,40,10,10,10,10,10","""We are impressed with their sense of design and marketing knowledge.""",,https://clutch.co/profile/evergreen-design-studio
Electric Brand Consultants,Logo Designers,Power of Ambition,5.0,5 REVIEWS,No,"$25,000+",$100 - $149 / hr,10 - 49,"Dubai, United Arab Emirates","Logo,Branding,Graphic Design,Web Design","10,40,30,20","""Electric Brand is one of the best agencies I’ve worked with. I’m looking forward to collaborating with them again.""",,https://clutch.co/profile/electric-brand-consultants
Cross Graphic Ideas,Logo Designers,Your Digital Design Support Partner,4.9,8 REVIEWS,No,"$1,000+",< $25 / hr,10 - 49,"JAIPUR, India","Logo,Web Design,Search Engine Optimization,Branding,Packaging Design,Social Media Marketing","25,25,20,15,10,5","""The designs from Crossgraphics have always been stellar.""",,https://clutch.co/profile/cross-graphic-ideas
"Iperdesign, Inc.",Logo Designers,Where Digital Meets Beautiful,4.9,17 REVIEWS,No,"$10,000+",$100 - $149 / hr,2 - 9,"Norristown, PA","Logo,Branding,UX/UI Design,Digital Strategy,Marketing Strategy,Web Design,Web Development","10,30,20,10,10,10,10","""Their communication was incredible, and the product they delivered exceeded my expectations.""",,https://clutch.co/profile/iperdesign
Unparallel Brand + Design,Logo Designers,"We build brands, businesses, and bottom-lines.",5.0,5 REVIEWS,No,"$5,000+",$100 - $149 / hr,2 - 9,"Toronto, Canada","Logo,Branding,Graphic Design,UX/UI Design,Web Design,Advertising,Mobile App Development,Web Development","20,25,15,15,10,5,5,5","''They provided invaluable, practical advice about how to achieve my vision.''",,https://clutch.co/profile/unparallel-brand-design
Cinnamon Toast,Logo Designers,Creative + Strategy,5.0,1 REVIEW,No,"$50,000+",$150 - $199 / hr,10 - 49,"Ottawa, Canada","Logo,Web Design,Branding,Advertising,Marketing Strategy,Digital Strategy,Media Planning & Buying,Search Engine Optimization,Social Media Marketing","10,30,20,10,10,5,5,5,5","""They do an excellent job of expanding beyond our immediate needs and understanding the situation.""",,https://clutch.co/profile/cinnamon-toast
Brand Institute,Logo Designers,Where Great Brands Begin! ®,5.0,3 REVIEWS,No,"$5,000+",Undisclosed,50 - 249,"Miami, FL","Logo,Branding,Market Research,Packaging Design,Web Design","10,70,10,5,5","“From their creatives to their regulatory experts, their team is very robust, helping clients through the process.”",,https://clutch.co/profile/brand-institute
Vedros Studio,Logo Designers,Brand Design and Research Studio,5.0,2 REVIEWS,No,"$10,000+",$150 - $199 / hr,2 - 9,"Los Angeles, CA","Logo,Branding,Packaging Design,Print Design,Web Design","20,30,20,20,10","""They were extremely good at managing communication and adhering to timelines as needed.""",,https://clutch.co/profile/vedros-studio
Toud,Logo Designers,We Help You Tell Your Story!,5.0,6 REVIEWS,No,"$10,000+",$50 - $99 / hr,2 - 9,"București, Romania","Logo,Branding,UX/UI Design","20,40,40","""Everything was very well done.""",,https://clutch.co/profile/toud
Design Shifu,Logo Designers,Unlimited Graphic Designs at a Monthly Flat Fee.,5.0,9 REVIEWS,No,"$1,000+",< $25 / hr,10 - 49,"Little Rock, AR","Logo,Graphic Design,Packaging Design,Print Design,Web Design","20,50,10,10,10","""Design Shifu greatly impacts the graphic design aspect of our business.""",,https://clutch.co/profile/design-shifu
UiSlick,Logo Designers,Web and Mobile App Development Company,5.0,19 REVIEWS,No,"$5,000+",$25 - $49 / hr,10 - 49,"Jaipur, India","Logo,Mobile App Development,UX/UI Design,Web Development","25,25,25,25","""Their UX/UI skills, as their company name suggests, were indeed slick and reflective of their talent.""",,https://clutch.co/profile/uislick
Herman-Scheer,Logo Designers,We bring smart consumer brands to market.,5.0,13 REVIEWS,No,"$25,000+",$150 - $199 / hr,2 - 9,"Los Angeles, CA","Logo,Branding,Packaging Design,UX/UI Design,Web Design","10,60,10,10,10","""These guys want you to be successful first - and have amazing work to be proud of in the process.""",,https://clutch.co/profile/herman-scheer
NUOVA Digital,Logo Designers,The Better Way to Grow Digital,5.0,8 REVIEWS,No,"$5,000+",$50 - $99 / hr,10 - 49,"San Francisco, CA","Logo,Web Design,Search Engine Optimization,Branding,Graphic Design","20,40,20,15,5","""The NUOVA Digital team is excellent at delivery.""",,https://clutch.co/profile/nuova-digital
Coe Design,Logo Designers,Branding and Packaging Solutions,5.0,1 REVIEW,No,"$5,000+",$100 - $149 / hr,2 - 9,"San Diego, CA","Logo,Advertising,Branding,Packaging Design,Product Design","20,20,20,20,20","""They chose really beautiful fonts and colors.""",,https://clutch.co/profile/coe-design
Avelts,Logo Designers,Website design & development,5.0,6 REVIEWS,No,"$1,000+",$25 - $49 / hr,10 - 49,"Sheridan, WY","Logo,E-Commerce Development,UX/UI Design,Web Design,Web Development","20,20,20,20,20",“Avelts was highly organized and did a stellar job at keeping track of the website’s different sections.”,,https://clutch.co/profile/avelts
LogoNow,Logo Designers,8+ Years in Businesss & Over 4000 Logos Designed,5.0,5 REVIEWS,No,Undisclosed,$25 - $49 / hr,2 - 9,"Erie, PA","Logo,Print Design,Graphic Design,Web Design","80,10,5,5",“Everything is just fine.”,,https://clutch.co/profile/logonow
FEELPIXEL,Logo Designers,UI/UX Design Studio,4.9,16 REVIEWS,No,"$10,000+",$25 - $49 / hr,10 - 49,"Pune, India","Logo,UX/UI Design,Branding,Web Design","10,70,10,10","“The team did a great job visualizing our goals, developing them into requirements, and executing them.",,https://clutch.co/profile/feelpixel
Greatives Web,Logo Designers,Web Design Agency,5.0,2 REVIEWS,No,"$5,000+",$100 - $149 / hr,2 - 9,"Psichiko, Greece","Logo,Web Development,Web Design","10,50,40","""Their technical and advisory skills are truly excellent.""",,https://clutch.co/profile/greatives-web
Justin Jenkins Designs,Logo Designers,Branding the World. One Client at a Time.™,5.0,7 REVIEWS,No,"$1,000+",$50 - $99 / hr,2 - 9,"New York, NY","Logo,Branding,Graphic Design,Web Design,Packaging Design","35,20,20,15,10","""I am very impressed with his creative thinking and the way he grasps the concepts that I was trying to convey.""",,https://clutch.co/profile/justin-jenkins-designs
the unicorn,Logo Designers,branding and animation storytellers,4.9,18 REVIEWS,No,"$5,000+",$100 - $149 / hr,10 - 49,"Kyiv, Ukraine","Logo,Video Production,Branding,Graphic Design,UX/UI Design,Packaging Design","10,35,25,15,10,5",''I can't think of anything they could do better.'',,https://clutch.co/profile/unicorn-0
Voice & Reason,Logo Designers,An agency built to unify the voice of your brand.,4.9,7 REVIEWS,No,"$10,000+",$100 - $149 / hr,2 - 9,"Folsom, CA","Logo,Web Design,Branding,Advertising,Event Marketing & Planning","10,35,25,20,10","""We're impressed with their extensive industry experience and knowledge.""",,https://clutch.co/profile/voice-reason
Hugs Branding,Logo Designers,Design agency on a subscription basis,4.8,3 REVIEWS,No,"$1,000+",$50 - $99 / hr,2 - 9,"Chişinău, Moldova","Logo,Branding,Graphic Design","45,45,10","""We had a lot of great feedback on the new branding, thanks to them.""",,https://clutch.co/profile/hugs-branding
Sphinxly,Logo Designers,"Web, funnel and digital marketing agency",5.0,5 REVIEWS,No,"$1,000+",$100 - $149 / hr,10 - 49,"Stockholm, Sweden","Logo,Web Design,Web Development,Digital Strategy,Video Production","10,30,30,20,10","""We experienced a priceless and generous delivery, which we greatly appreciated.""",,https://clutch.co/profile/sphinxly
Cretos,Logo Designers,Design agency that adds value to digital products,4.9,7 REVIEWS,No,"$5,000+",$25 - $49 / hr,10 - 49,"Yerevan, Armenia","Logo,UX/UI Design,Product Design,Web Design,Graphic Design","10,30,25,25,10","""They created magic in terms of design, which was exciting.""",,https://clutch.co/profile/cretos-0
Limbus Studio,Logo Designers,Graphic and digital design studio,5.0,1 REVIEW,No,"$5,000+",$100 - $149 / hr,2 - 9,"Paris, France","Logo,Graphic Design,Web Design,E-Commerce Development,Print Design,UX/UI Design,Packaging Design,Web Development","20,20,20,10,10,10,5,5","""Their mastery of most subjects and artistic talent are impressive.""",,https://clutch.co/profile/limbus-studio
modern8,Logo Designers,Brand by Design,5.0,13 REVIEWS,No,"$50,000+",$150 - $199 / hr,10 - 49,"Salt Lake City, UT","Logo,Branding,Packaging Design,Social Media Marketing,Web Design","15,60,15,5,5",“What stood out to me about modern8 was the collaborative and comprehensive nature of their brand development process.”,,https://clutch.co/profile/modern8
