Name,Type of Agency,Tagline,Ratings,Reviews,Sponsor,MinProjectSize,HourlyRate,TeamSize,Location,ServiceNames,ServicePercentages,Feedback,WebsiteLink,ClutchDirectoryLink
EIGHT25MEDIA,Web Design,Award Winning Firm with 750+ Clients,4.9,27 REVIEWS,Yes,"$75,000+",$100 - $149 / hr,50 - 249,"San Jose, CA","Web Design,Web Development,Digital Strategy,UX/UI Design","50,30,10,10","""They were patient with our questions, requests, and tight timelines and provided clear explanations and solutions.""",http://www.eight25media.com/?utm_source=clutch&utm_medium=referral&utm_campaign=web-designers,https://clutch.co/profile/eight25media
500 Designs,Web Design,"We create impactful apps, branding & websites",5.0,25 REVIEWS,Yes,"$25,000+",$100 - $149 / hr,50 - 249,"Irvine, CA","Web Design,Branding,Advertising,Digital Strategy,Marketing Strategy,Product Design,UX/UI Design","25,25,10,10,10,10,10","""This team is unique — they are all engaged, authentic, and talented.""",https://500designs.com/?utm_source=Clutch&utm_medium=Referral&utm_campaign=top_web_designers&utm_id=Clutch+Web+Design&utm_term=web_designers,https://clutch.co/profile/500-designs
Dotlogics,Web Design,Your Digital Growth Partner,5.0,21 REVIEWS,Yes,"$25,000+",$150 - $199 / hr,50 - 249,"East Northport, NY","Web Design,Branding,Digital Strategy,Custom Software Development","60,15,15,10","""Their experience speaks volumes and drives our digital growth.""",https://www.dotlogics.com/?utm_source=clutch.co&utm_medium=referral&utm_campaign=web-designers,https://clutch.co/profile/dotlogics
Clay,Web Design,World-class digital products and brands,4.9,21 REVIEWS,Yes,"$50,000+",$150 - $199 / hr,10 - 49,"San Francisco, CA","Web Design,UX/UI Design,Branding","30,45,25","""They worked as an extension of our own team. They truly cared about the product and its design as much as we did.""",https://clay.global/?utm_source=clutch&utm_medium=referral&utm_campaign=web-designers,https://clutch.co/profile/clay
eDesign Interactive,Web Design,Award-Winning Web Design & Digital Marketing,4.9,30 REVIEWS,Yes,"$50,000+",$150 - $199 / hr,10 - 49,"Morristown, NJ","Web Design,Branding,UX/UI Design,Digital Strategy,Social Media Marketing","40,20,20,10,10",“Our website is 10 million steps up from where we came from.”,https://edesigninteractive.com/?utm_source=clutch.co&utm_medium=referral&utm_campaign=web-designers,https://clutch.co/profile/edesign-interactive
Lounge Lizard,Web Design,25 Years! Website Design. Digital Marketing & SEO.,4.8,21 REVIEWS,Yes,"$25,000+",$150 - $199 / hr,10 - 49,"New York, NY","Web Design,Web Development,Custom Software Development,Digital Strategy","50,30,10,10","""Their desire to truly understand our business goals for the new website was impressive.""",https://www.loungelizard.com/?utm_source=clutch&utm_campaign=clutchwebdesigner1,https://clutch.co/profile/lounge-lizard
Zero Negative,Web Design,Boutique studio creating tailored web experiences,5.0,14 REVIEWS,Yes,"$25,000+",$100 - $149 / hr,2 - 9,"Boston, MA","Web Design,Web Development,Branding","45,45,10","""Their teammates are true unicorns in the field of design and development; we instantly knew it was the right fit.""",https://zeronegative.net/?utm_source=clutch.co&utm_medium=referral&utm_campaign=web-designers,https://clutch.co/profile/zero-negative
Bop Design,Web Design,B2B Website Design & Marketing--#1 Clutch Ranking,5.0,89 REVIEWS,Yes,"$25,000+",$150 - $199 / hr,10 - 49,"San Diego, CA","Web Design,Content Marketing,Digital Strategy,Print Design","65,20,10,5",''Support through the process was nothing short of phenomenal.'',https://www.bopdesign.com/?utm_source=clutch.co&utm_medium=referral&utm_campaign=web-designers,https://clutch.co/profile/bop-design
DD.NYC®,Web Design,The Best Web Design and Branding Agency on Clutch!,5.0,71 REVIEWS,Yes,"$10,000+",$150 - $199 / hr,10 - 49,"New York, NY","Web Design,Branding,Graphic Design,Packaging Design","60,20,10,10","""It has been an absolute pleasure to work with them.""",https://dd.nyc/services/web-design/?utm_source=clutch.co&utm_medium=referral&utm_campaign=active_sponsorship&utm_content=web-designers-sponsored-gold,https://clutch.co/profile/ddnyc-0
HUEMOR,Web Design,"Memorable Websites, Guaranteed Results.",4.8,45 REVIEWS,Yes,"$5,000+",$150 - $199 / hr,50 - 249,"Pittsburgh, PA","Web Design,Web Development","60,40","""No one on our team has ever been involved in a redesign, but Huemor made everything smooth and easy.""",https://huemor.rocks/?utm_source=clutch.co&utm_medium=referral&utm_campaign=web-designers,https://clutch.co/profile/huemor
Revealize Inc.,Web Design,Our Designs Speak For Themselves,5.0,21 REVIEWS,Yes,"$25,000+",$150 - $199 / hr,10 - 49,"Newport Beach, CA","Web Design,Web Development,Custom Software Development,Mobile App Development","65,15,10,10",“Revealize Inc. has been incredibly accommodating of our feedback and requests.”,https://revealize.com/?utm_source=clutch.co&utm_medium=referral&utm_campaign=web-designers,https://clutch.co/profile/revealize
BOWEN,Web Design,Premium Web Design Agency based in the USA,5.0,11 REVIEWS,Yes,"$25,000+",$150 - $199 / hr,10 - 49,"Mineola, NY","Web Design,Web Development,UX/UI Design","50,30,20","""I was impressed by their eagerness to build something very successful for our business.""",https://www.bowenmedia.com/?utm_source=clutch.co&utm_medium=referral&utm_campaign=web-designers,https://clutch.co/profile/bowen
Alian Software Inc.,Web Design,Top Web designers and developers,4.9,28 REVIEWS,Yes,"$1,000+",$25 - $49 / hr,50 - 249,"Anand, India","Web Design,Web Development,E-Commerce Development,UX/UI Design","35,30,25,10","""The quality of their work has exceeded our expectations.""",https://aliansoftware.com/hire/top-shopify-developers?utm_source=clutch.co&utm_medium=referral&utm_campaign=web-designers,https://clutch.co/profile/alian-software
Wanted for Nothing,Web Design,WFN is a Top Rated Digital Agency in Los Angeles,5.0,14 REVIEWS,Yes,"$25,000+",$50 - $99 / hr,10 - 49,"Los Angeles, CA","Web Design,Web Development,E-Commerce Development,UX/UI Design","40,30,20,10","""They were able to uncover our opportunities and delivered the findings into a well-functioning software.""",https://wantedfornothing.com/?utm_source=clutch.co&utm_medium=referral&utm_campaign=web-designers,https://clutch.co/profile/wanted-nothing
Adchitects,Web Design,World-Class Digital Products. On-time. On-budget.,4.9,46 REVIEWS,Yes,"$10,000+",$50 - $99 / hr,10 - 49,"Poznań, Poland","Web Design,Web Development,E-Commerce Development,Mobile App Development,UX/UI Design","35,25,20,10,10","""They knew how to run a tight ship — their control was impressive, even bordering on mechanical.""",https://adchitects.co/?utm_source=clutch.co&utm_medium=referral&utm_campaign=web-design,https://clutch.co/profile/adchitects
Creative Brand Design,Web Design,Experts in Website Design & Development,5.0,44 REVIEWS,Yes,"$5,000+",$100 - $149 / hr,10 - 49,"London, United Kingdom","Web Design,E-Commerce Development,Search Engine Optimization,Branding","75,10,10,5","""They created visually appealing designs from scratch and made them look complete and coherent in only three weeks.""",https://cbwebsitedesign.co.uk/?utm_source=clutch.co&utm_medium=referral&utm_campaign=web-designers,https://clutch.co/profile/creative-brand-design
Tiny Frog Technologies,Web Design,Top-Rated WordPress Web Design & Development,4.9,70 REVIEWS,Yes,"$5,000+",$100 - $149 / hr,10 - 49,"San Diego, CA","Web Design,Web Development,E-Commerce Development","65,30,5","""The results were impressive due to each team member's exceptional knowledge and expertise.""",https://tinyfrog.com/?utm_source=clutch.co&utm_medium=referral&utm_campaign=web-designers,https://clutch.co/profile/tiny-frog-technologies
Together,Web Design,"Full-Service Agency — Brand, Web, Product UI/UX",4.9,34 REVIEWS,Yes,"$25,000+",$150 - $199 / hr,10 - 49,"London, United Kingdom","Web Design,Branding,Product Design,UX/UI Design,Web Development","20,20,20,20,20","""They have a knack for taking something complicated and making it simple and beautiful.""",https://together.agency/?utm_source=clutch.co&utm_medium=referral&utm_campaign=web-designers,https://clutch.co/profile/together
Isadora Agency,Web Design,Leader in Enterprise Digital Transformations,4.8,17 REVIEWS,Yes,"$75,000+",$150 - $199 / hr,10 - 49,"Manhattan Beach, CA","Web Design,Web Development,E-Commerce Development,Product Design,UX/UI Design","30,25,20,15,10","""They listened to our needs, addressed any questions quickly yet thoroughly, and made great recommendations.""",http://isadoradigitalagency.com/?utm_source=clutch-web-designers&utm_medium=cpc&utm_campaign=web-designers&utm_term=w-des&utm_content=w-des,https://clutch.co/profile/isadora-agency
The Creative Momentum,Web Design,An Amazing Digital Experience,5.0,10 REVIEWS,Yes,Undisclosed,$150 - $199 / hr,10 - 49,"Alpharetta, GA","Web Design,Web Development,Conversion Optimization,Pay Per Click,Search Engine Optimization,UX/UI Design","40,20,10,10,10,10",“We were very pleased with their work and had an excellent experience throughout the engagement.”,http://www.thecreativemomentum.com/?utm_source=clutch.co&utm_medium=referral&utm_campaign=web-designers,https://clutch.co/profile/creative-momentum
IT Monks Agency,Web Design,"Unique WordPress websites, tailored for your brand",5.0,13 REVIEWS,Yes,"$10,000+",$50 - $99 / hr,10 - 49,"Kraków, Poland","Web Design,Web Development,E-Commerce Development,UX/UI Design","40,40,10,10","""The team has a high mastery of WordPress, so what they’ve done is top-notch.""",https://itmonks.com/welcome-page/?utm_source=clutch.co&utm_medium=referral&utm_campaign=web-design,https://clutch.co/profile/it-monks-agency
dops.digital,Web Design,We create live websites and brand identity design,5.0,31 REVIEWS,Yes,"$10,000+",$50 - $99 / hr,10 - 49,"L'viv, Ukraine","Web Design,UX/UI Design","80,20","""We will definitely work with them again for a website for our other brand.""",https://dops.digital/?utm_source=clutch.co&utm_medium=referral&utm_campaign=web-designers,https://clutch.co/profile/dopsdigital
Parachute Design Group Inc.,Web Design,"Award-winning Web Design, Development & SEO",4.9,29 REVIEWS,Yes,"$50,000+",$150 - $199 / hr,2 - 9,"Toronto, Canada","Web Design,Web Development,Branding,Search Engine Optimization,UX/UI Design","60,25,5,5,5","""Working with Parachute is one of the best project experiences I’ve had in 20 years.""",https://parachutedesign.ca/?utm_source=clutch.co&utm_medium=referral&utm_campaign=web-designers,https://clutch.co/profile/parachute-design-group
Windmill Strategy,Web Design,Industrial Web Design & B2B Digital Marketing,4.9,15 REVIEWS,Yes,"$25,000+",$150 - $199 / hr,10 - 49,"Minneapolis, MN","Web Design,Web Development,Digital Strategy,Search Engine Optimization","50,25,15,10","""Our marketing team was very happy with the project.""",https://www.windmillstrategy.com/?utm_source=clutch.co&utm_medium=referral&utm_campaign=web-designers,https://clutch.co/profile/windmill-strategy
Top Notch Dezigns,Web Design,Top Rated Web Design + Digital Marketing Agency,5.0,12 REVIEWS,Yes,"$10,000+",$150 - $199 / hr,10 - 49,"New York, NY","Web Design,Web Development,Custom Software Development","70,20,10","""They care about producing quality work that matches what I’m trying to achieve.""",https://www.topnotchdezigns.com/?utm_source=clutch.co&utm_medium=referral&utm_campaign=web-designers,https://clutch.co/profile/top-notch-dezigns
UX studio,Web Design,"UX/UI, Web Design, and Research Agency",5.0,33 REVIEWS,Yes,"$5,000+",$50 - $99 / hr,50 - 249,"Budapest, Hungary","Web Design,UX/UI Design,Product Design","35,55,10","""They brought fresh, innovative ideas to the table and weren't afraid to take risks to create something unique.""",https://uxstudioteam.com/your-design-partner?utm_source=clutch.co&utm_medium=referral&utm_campaign=web-designers,https://clutch.co/profile/ux-studio
Mighty Fine,Web Design,Strategy and Design Beautifully Executed,5.0,15 REVIEWS,Yes,"$5,000+",$100 - $149 / hr,2 - 9,"Tampa, FL","Web Design,Advertising,Branding","55,35,10",“Their whole team is really great and easy to work with.”,https://www.mightyfinedesign.co/?utm_source=clutch.co&utm_medium=referral&utm_campaign=web-designers,https://clutch.co/profile/mighty-fine
North Street Creative,Web Design,Crafting first and lasting impressions,5.0,24 REVIEWS,Yes,"$25,000+",$200 - $300 / hr,10 - 49,"New York, NY","Web Design,Branding,Graphic Design,Web Development","30,30,20,20","""They were beyond easy to work with from start to finish.""",https://northstreetcreative.com/?utm_source=clutch.co&utm_medium=referral&utm_campaign=web-designers,https://clutch.co/profile/north-street-creative
Coders.Dev,Web Design,Ideal Mobile App & Web Solutions,4.9,8 REVIEWS,Yes,"$5,000+",< $25 / hr,250 - 999,"London, United Kingdom","Web Design,AI Development,BI & Big Data Consulting & SI,Cloud Consulting & SI,Custom Software Development,IT Strategy Consulting,Pay Per Click,Search Engine Optimization,Web Development","20,10,10,10,10,10,10,10,10","""We were very satisfied working with Coders.Dev as they delivered a beautiful website.""",https://coders.dev/?utm_source=clutch.co&utm_medium=referral&utm_campaign=web-designers,https://clutch.co/profile/codersdev
Nika Digital Agency,Web Design,Your Creative Digital Partner.,5.0,35 REVIEWS,Yes,"$10,000+",$100 - $149 / hr,10 - 49,"San Jose, CA","Web Design,UX/UI Design,Web Development","40,30,30","""Outside of their terrific work, I have always been impressed with the customer service Nika Digital Agency provides.""",http://www.nika.agency/?utm_source=clutch.co&utm_medium=referral&utm_campaign=web-designers,https://clutch.co/profile/nika-digital-agency
QClay,Web Design,We Create Everlasting Designs. Check Our Portfolio,5.0,27 REVIEWS,Yes,"$10,000+",$100 - $149 / hr,50 - 249,"San Francisco, CA","Web Design,UX/UI Design,Branding,Web Development,Product Design","30,30,15,15,10","""It's been a great dynamic between our product owner and the QClay team.""",https://qclay.design/?utm_source=clutch.co&utm_medium=referral&utm_campaign=web-designers,https://clutch.co/profile/qclay
Excited,Web Design,"Product Design Agency | Web, SaaS, Mobile",5.0,37 REVIEWS,Yes,"$10,000+",$50 - $99 / hr,10 - 49,"L'viv, Ukraine","Web Design,UX/UI Design","10,90","""I am continually impressed with the quality, communication, and value they consistently provide.""",https://excited.agency/?utm_source=clutch.co&utm_medium=referral&utm_campaign=web-designers,https://clutch.co/profile/excited
Envy Design Co.,Web Design,Enviable Creative Services,5.0,22 REVIEWS,Yes,"$5,000+",$100 - $149 / hr,2 - 9,"Shannonville, Canada","Web Design,Branding,Graphic Design,Packaging Design,UX/UI Design","50,20,10,10,10","""Envy Design Co. truly has a passion for creating visually stunning and user-friendly websites.""",https://envydesign.co/website-design-development/?utm_source=clutch.co&utm_medium=referral&utm_campaign=web-designers,https://clutch.co/profile/envy-design-co
nclud,Web Design,A Provocative Creative Agency,4.8,8 REVIEWS,Yes,"$25,000+",$150 - $199 / hr,10 - 49,"Washington, D.C., DC","Web Design,Web Development,Branding","30,40,30",“They’ve given us everything that we’ve asked for and more.”,https://nclud.com/?utm_source=clutch.co&utm_medium=referral&utm_campaign=web-designers,https://clutch.co/profile/nclud
Orizon Design,Web Design,"App design, Websites, Brands, 3d & Webflow landing",4.8,27 REVIEWS,Yes,"$25,000+",$100 - $149 / hr,10 - 49,"Montréal, Canada","Web Design,UX/UI Design,Product Design,Branding,Mobile App Development,Video Production,Web Development","20,25,15,10,10,10,10","""They have a very methodical workflow that produces amazing designs in a very short time.""",https://orizon.co/?utm_source=clutch.co/&utm_medium=referral&utm_campaign=web-designers,https://clutch.co/profile/orizon-design
Pyxl,Web Design,A Different Digital Agency,4.9,14 REVIEWS,Yes,"$25,000+",$150 - $199 / hr,10 - 49,"Nashville, TN","Web Design,Digital Strategy,Web Development,Branding,Content Marketing","25,30,25,10,10",“You can really easily see the care that they have for our product and our relationship.”,https://pyxl.com/?utm_source=clutch.co&utm_medium=referral&utm_campaign=directory,https://clutch.co/profile/pyxl
Greenflag media,Web Design,The Agency for Changemakers,5.0,17 REVIEWS,Yes,"$5,000+",$100 - $149 / hr,2 - 9,"Columbia, MD","Web Design,Digital Strategy,Search Engine Optimization,Branding","40,25,25,10","""We were very happy with their work.""",https://greenflagmedia.co/?utm_source=clutch.co&utm_medium=referral&utm_campaign=web-designers,https://clutch.co/profile/greenflag-media
PopArt Studio,Web Design,Full-service web design and development agency,5.0,58 REVIEWS,Yes,"$5,000+",$50 - $99 / hr,50 - 249,"Chicago, IL","Web Design,Web Development,Search Engine Optimization","55,35,10",“Our developer had a lot of experience and was able to guide us.”,https://www.popwebdesign.net/index_eng.html?utm_source=clutch.co&utm_medium=referral&utm_campaign=web-design,https://clutch.co/profile/popart-studio
Outcrowd,Web Design,Web design & branding to increase startups' value,4.9,59 REVIEWS,Yes,"$5,000+",$50 - $99 / hr,10 - 49,"Lewes, DE","Web Design,Logo,UX/UI Design,Branding","60,15,15,10","""The talents and the skill set of the team were simply impressive.""",https://www.outcrowd.io/design-page/?utm_source=clutch.co&utm_medium=referral&utm_campaign=web-designers,https://clutch.co/profile/outcrowd
Sayenko Design,Web Design,Award Winning Web Design - 170+ Reviews,4.8,64 REVIEWS,Yes,"$10,000+",$150 - $199 / hr,2 - 9,"Seattle, WA","Web Design,Web Development","75,25",''They adapted to our requirements.'',http://www.sayenkodesign.com/?utm_source=clutch.co&utm_medium=referral&utm_campaign=web-designers,https://clutch.co/profile/sayenko-design
Eggs Media,Web Design,Brilliance Hatched.,4.9,25 REVIEWS,Yes,"$1,000+",$50 - $99 / hr,2 - 9,"Toronto, Canada","Web Design,Web Development,E-Commerce Development","70,20,10","""Everything has been impressive with Eggs Media.""",https://eggsmedia.com/?utm_source=clutch.co&utm_medium=referral&utm_campaign=web-designers,https://clutch.co/profile/eggs-media
EuroART93,Web Design,Award winning full-service digital agency!,4.9,19 REVIEWS,Yes,"$10,000+",$50 - $99 / hr,10 - 49,"Sisak, Croatia","Web Design,Web Development,UX/UI Design,Branding,Social Media Marketing","30,30,20,10,10","""What struck me as most impressive about this company was their dedication to both quality and customer satisfaction.""",https://euroart93.hr/?utm_source=clutch.co&utm_medium=referral&utm_campaign=web-designers,https://clutch.co/profile/euroart93
Anchour,Web Design,Helping the good ones win.,5.0,39 REVIEWS,Yes,"$25,000+",$150 - $199 / hr,10 - 49,"Lewiston, ME","Web Design,Branding,Advertising","20,60,20","“They were a team of real professionals that were serious about delivering high-quality, creative work.”",https://www.anchour.com/?utm_source=clutch.co&utm_medium=directory,https://clutch.co/profile/anchour
Temper And Forge,Web Design,WordPress Development & Design,5.0,41 REVIEWS,Yes,"$10,000+",$100 - $149 / hr,2 - 9,"Boston, MA","Web Design,Web Development,Branding,Print Design,UX/UI Design","35,35,10,10,10","""Temper And Forge was one of the most professional companies I’ve ever worked with.""",https://temperandforge.com/?utm_source=clutch.co&utm_medium=referral&utm_campaign=web-designers,https://clutch.co/profile/temper-forge
Culture Foundry,Web Design,Thrive in Digital,5.0,8 REVIEWS,Yes,"$25,000+",$150 - $199 / hr,10 - 49,"Seattle, WA","Web Design,Application Management & Support,Digital Strategy,Web Development","25,25,25,25","""Culture Foundry's commitment to their customers is unique.""",https://www.culturefoundry.com/?utm_source=clutch.co&utm_medium=referral&utm_campaign=web-designers,https://clutch.co/profile/culture-foundry
Blacksmith Agency,Web Design,Forging award-winning digital projects since 2011,4.7,15 REVIEWS,Yes,"$50,000+",$150 - $199 / hr,10 - 49,"New York, NY","Web Design,Web Development,E-Commerce Development,Custom Software Development","30,40,20,10","""We always feel like we are their highest priority. They've never missed any deadlines and often are ahead of schedule.""",https://blacksmith.agency/?utm_source=Clutch&utm_medium=Referral&utm_campaign=web-designers,https://clutch.co/profile/blacksmith-agency
Burst Digital,Web Design,We create & grow show-stopping brands worldwide.,4.9,9 REVIEWS,Yes,"$5,000+",$50 - $99 / hr,2 - 9,"London, United Kingdom","Web Design,Branding,Graphic Design,Logo,Search Engine Optimization,Social Media Marketing,UX/UI Design,Web Development","20,20,10,10,10,10,10,10",“We’re most impressed with Burst Digital’s flexibility and willingness to go the extra mile to cater to our needs.,https://burstdgtl.com/?utm_source=clutch.co&utm_medium=referral&utm_campaign=web-designers,https://clutch.co/profile/burst-digital-1
Auxesis Infotech Pvt. Ltd.,Web Design,"Web, Software & Mobile App Development Agency",4.9,30 REVIEWS,Yes,"$5,000+",< $25 / hr,50 - 249,"New York, NY","Web Design,Custom Software Development,Mobile App Development,Web Development,E-Commerce Development","35,25,15,15,10",“They quickly grasped complex subjects and made them a reality.”,https://auxesisinfotech.com/?utm_source=clutch.co&utm_medium=referral&utm_campaign=web-designers,https://clutch.co/profile/auxesis-infotech
"Cozy Design, Inc.",Web Design,Unleash your SMB with our complete creative dept,5.0,19 REVIEWS,Yes,"$50,000+",$150 - $199 / hr,2 - 9,"San Diego, CA","Web Design,UX/UI Design,Content Marketing,Graphic Design,Branding","25,30,20,15,10","“They understand the importance of UX within a broader organizational context, which is really powerful.”",https://www.cozydesign.com/?utm_source=clutch.co&utm_medium=referral&utm_campaign=web-designers,https://clutch.co/profile/cozy-design
Solar Digital,Web Design,Design thinking web development team,4.9,27 REVIEWS,Yes,"$5,000+",$25 - $49 / hr,10 - 49,"Odesa, Ukraine","Web Design,Web Development,Custom Software Development,UX/UI Design,Mobile App Development","20,35,20,15,10",“They go quite deep in order to understand how our industry is working and to create a product that we really need.”,https://solar-digital.com/?utm_source=clutch.co&utm_medium=referral&utm_campaign=web-designers,https://clutch.co/profile/solar-digital
MakeING,Web Design,Conversion-Driven Websites w/ 3D/AR | UX/UI Design,5.0,12 REVIEWS,Yes,"$10,000+",$50 - $99 / hr,2 - 9,"Odessa, Ukraine","Web Design,UX/UI Design,Web Development,E-Commerce Development","30,30,30,10","“If you need a very custom website, go with MakeING; they’re a very capable and skilled group.”",https://makeing.net/?utm_source=clutch.co&utm_medium=referral&utm_campaign=web-designers,https://clutch.co/profile/makeing
Human Creative,Web Design,Successful Websites = Strong Brands,4.9,20 REVIEWS,Yes,"$5,000+",$25 - $49 / hr,2 - 9,"Poznań, Poland","Web Design,Branding,UX/UI Design,Video Production,Web Development","50,20,10,10,10","""What I found most unique was how they were friendly and understanding of our needs.""",https://human-creative.co/?utm_source=clutch.co&utm_medium=referral&utm_campaign=agencies-web-designers,https://clutch.co/profile/human-creative-1
BragDeal Inc.,Web Design,Websites To Brag About,5.0,15 REVIEWS,Yes,"$10,000+",$100 - $149 / hr,2 - 9,"Vancouver, Canada","Web Design,Web Development,E-Commerce Development,Branding","35,35,20,10",“Their strengths are their creativity and ability to meet deadlines.”,https://www.bragdeal.com/?utm_source=clutch.co&utm_medium=referral&utm_campaign=ca-web-designers,https://clutch.co/profile/bragdeal
Grafit Agency,Web Design,Design focused digital agency.,5.0,27 REVIEWS,Yes,"$10,000+",$50 - $99 / hr,2 - 9,"Warszawa, Poland","Web Design,UX/UI Design,Web Development","30,40,30","""They have a good understanding of the latest trends in design and the best practices of good design.""",https://grafit.agency/?utm_source=clutch.co&utm_medium=referral&utm_campaign=web-designers,https://clutch.co/profile/grafit-agency
Byte Technology,Web Design,Award Winning Web Agency,5.0,1 REVIEW,Yes,"$1,000+",$100 - $149 / hr,10 - 49,"Littleton, CO","Web Design,E-Commerce Development,Web Development,Search Engine Optimization,Marketing Strategy","25,25,25,15,10","""Their team of talented and competent developers is able to understand and implement the features we wanted.""",https://bytetechnology.com/web-design-landing/?utm_source=clutch.co&utm_medium=referral&utm_campaign=directory,https://clutch.co/profile/byte-technology
Mountaintop Web Design,Web Design,We Help You Grow Your Business,5.0,3 REVIEWS,Yes,"$1,000+",$100 - $149 / hr,2 - 9,"Greenwood Village, CO","Web Design,Web Development,Search Engine Optimization,Marketing Strategy","40,30,20,10","""Mountaintop Web Design’s instruction helped get us on the right path for what were we trying to communicate.""",https://mountaintopwebdesign.com/responsive-website-design/?utm_source=clutch.co&utm_medium=referral&utm_campaign=web-designers,https://clutch.co/profile/mountaintop-web-design
codebuild_,Web Design,Develop digital products your users will love,5.0,4 REVIEWS,Yes,"$5,000+",$50 - $99 / hr,2 - 9,"Budapest, Hungary","Web Design,Custom Software Development,E-Commerce Development,Mobile App Development,Web Development,UX/UI Design","10,20,20,20,20,10","""Everything is great.""",https://codebuild.eu/estimate-project/?utm_source=clutch.co&utm_medium=referral&utm_campaign=web-designers,https://clutch.co/profile/codebuild
