Name,Type of Agency,Tagline,Ratings,Reviews,Sponsor,MinProjectSize,HourlyRate,TeamSize,Location,ServiceNames,ServicePercentages,Feedback,WebsiteLink,ClutchDirectoryLink
Aalpha Information Systems India Pvt. Ltd,Web Design,Top Quality Development Starting at 15USD P/H,4.9,173 REVIEWS,No,"$1,000+",< $25 / hr,2 - 9,"Bengaluru, India","Web Design,Web Development,Custom Software Development,E-Commerce Development,Mobile App Development","10,60,10,10,10","""We're very happy with the results of our partnership with them.""",https://www.aalpha.net/?utm_source=clutch&utm_medium=referral,https://clutch.co/profile/aalpha-information-systems-india
Mtoag Technologies Pvt LTD.,Web Design,Moving Technology On A Go,5.0,21 REVIEWS,No,"$5,000+",$25 - $49 / hr,50 - 249,"Jaipur, India","Web Design,Mobile App Development,Web Development,E-Commerce Development","10,50,30,10","""We highly recommend them to anyone looking for an experienced and reliable mobile app development team.""",https://mtoag.com/?utm_source=clutch.co&utm_medium=referral&utm_campaign=web-designers,https://clutch.co/profile/mtoag-technologies
ENDERTECH,Web Design,// LOVE THY NEIGHBOR. MASTER THY CRAFT.,4.9,30 REVIEWS,No,"$10,000+",$100 - $149 / hr,10 - 49,"Los Angeles, CA","Web Design,Custom Software Development,E-Commerce Development,UX/UI Design,Web Development","15,30,30,15,10",“They were fully capable of providing us all the help we needed.”,https://endertech.com/?utm_source=clutch.co&utm_medium=referral&utm_campaign=web-designers,https://clutch.co/profile/endertech
Moburst,Web Design,Digital & Mobile Growth | Become a Category Leader,4.9,34 REVIEWS,No,"$25,000+",$150 - $199 / hr,10 - 49,"New York, NY","Web Design,Mobile & App Marketing,Advertising,Social Media Marketing,Web Development","10,60,10,10,10","""They're really good at leveraging new technologies and best practices to stay ahead of the curve.""",https://moburst.com/make-my-website-better/?utm_source=clutch.co&utm_medium=referral&utm_campaign=web-designers,https://clutch.co/profile/moburst
S'more Brands,Web Design,"Gooey, delicious websites and brands.",5.0,5 REVIEWS,No,"$10,000+",$100 - $149 / hr,2 - 9,"Vancouver, WA","Web Design,Branding","60,40","""We're excited to work with S'more Brands again to address our future business needs.""",https://smorebrands.com/services/website-offering/?utm_source=clutch.co&utm_medium=referral&utm_campaign=directory,https://clutch.co/profile/smore-brands
AMR Softec,Web Design,"#1 Web Design, E-commerce Development & SEO Agency",5.0,26 REVIEWS,No,"$1,000+",< $25 / hr,2 - 9,"Sahibzada Ajit Singh Nagar, India",Web Design,100,“I’d advise customers looking for website or online platform development services to hire AMR Softec.,https://www.amrsoftec.com/?utm_source=clutch.co&utm_medium=referral&utm_campaign=directory,https://clutch.co/profile/amr-softec
Watson Creative,Web Design,An Award Winning Brand Strategy & Digital Agency,5.0,34 REVIEWS,No,Undisclosed,$150 - $199 / hr,50 - 249,"Portland, OR","Web Design,Branding,Digital Strategy,Advertising","25,40,25,10","""We felt motivated and were constantly learning new trends and marketing concepts in the industry.""",https://watsoncreative.com/,https://clutch.co/profile/watson-creative
Comrade Digital Marketing Agency,Web Design,"Grow Your Business, Guaranteed ⚡️",4.8,61 REVIEWS,No,"$10,000+",$100 - $149 / hr,10 - 49,"Chicago, IL","Web Design,Search Engine Optimization,Advertising,Pay Per Click","15,65,10,10","“Our team feels comfortable with them, and they serve as an extension of our team.”",https://comradeweb.com/?utm_source=clutch.co&utm_medium=referral,https://clutch.co/profile/comrade-digital-marketing-agency
Blue Flamingo Solutions,Web Design,Award winning web design and development agency,4.9,5 REVIEWS,No,"$5,000+",$100 - $149 / hr,10 - 49,"Toronto, Canada","Web Design,Search Engine Optimization","85,15",“Blue Flamingo offers excellent expertise with an extremely friendly and helpful attitude.”,http://www.blueflamingo.solutions/?utm_source=clutch.co&utm_medium=referral&utm_campaign=directory,https://clutch.co/profile/blue-flamingo-solutions
The Alfam,Web Design,Innovative Web & App Design + UX/UI Experts,5.0,20 REVIEWS,No,"$5,000+",$100 - $149 / hr,2 - 9,"New York, NY","Web Design,UX/UI Design,Branding,E-Commerce Development","50,20,15,15","""I am highly impressed by the design and product iterations.""",https://thealfam.com/,https://clutch.co/profile/alfam
LoveGunn,Web Design,Right from the heart. Straight to the point.,4.9,31 REVIEWS,No,"$10,000+",$100 - $149 / hr,10 - 49,"London, United Kingdom","Web Design,Branding,Graphic Design,Packaging Design,Print Design,UX/UI Design","10,50,10,10,10,10","""The team was responsive to change and feedback almost instantly!""",https://www.lovegunn.co/?utm_source=clutch.co&utm_medium=referral,https://clutch.co/profile/lovegunn
Kinex Media,Web Design,"We Design, Develop and Deliver",5.0,10 REVIEWS,No,"$5,000+",$100 - $149 / hr,50 - 249,"Mississauga, Canada","Web Design,E-Commerce Development,Search Engine Optimization,Web Development","40,40,15,5","""They’re very reliable.""",https://www.kinexmedia.com/?utm_source=clutch.co&utm_medium=referral&utm_campaign=directory,https://clutch.co/profile/kinex-media
Rattlesnake Group,Web Design,Boutique Branding & Web Design agency in London,5.0,15 REVIEWS,No,"$10,000+",$100 - $149 / hr,10 - 49,"London, United Kingdom","Web Design,Branding,UX/UI Design,Web Development","35,35,15,15","""They were very communicative and responsive — we felt like we were their top priority in every regard.""",https://www.rsnake.co.uk/,https://clutch.co/profile/rattlesnake-group
Channel V Media,Web Design,We position companies for market success,5.0,6 REVIEWS,No,"$10,000+",$150 - $199 / hr,10 - 49,"New York, NY","Web Design,Public Relations","20,80","“Their recommendations are always fresh and authentic to our brand, which allows us to stand out.”",https://channelvmedia.com/?utm_source=clutch.co&utm_medium=referral&utm_campaign=directory,https://clutch.co/profile/channel-v-media
WPExperts,Web Design,Full Stack WordPress Development Agency,5.0,62 REVIEWS,No,"$10,000+",$50 - $99 / hr,50 - 249,"Karachi, Pakistan","Web Design,E-Commerce Development,Web Development,Custom Software Development,IT Staff Augmentation","10,25,25,20,20","""They were the first company we worked with that met their quoted deadlines and cost.""",https://wpexperts.io/?utm_source=clutch.co&utm_medium=referral&utm_campaign=directory,https://clutch.co/profile/wpexperts
DIGITECH,Web Design,Design + Exclusive SEO That Helps Brands Grow,4.9,29 REVIEWS,No,"$25,000+",$150 - $199 / hr,2 - 9,"Austin, TX","Web Design,Search Engine Optimization,Branding,UX/UI Design,Web Development","40,30,10,10,10","""Their finished product has blown the healthcare industry out of the water.""",https://digitechwebdesignaustin.com/?utm_source=clutch.co&utm_medium=referral&utm_campaign=web-designers,https://clutch.co/profile/digitech
Gripped,Web Design,A digital first sales & marketing agency,4.9,15 REVIEWS,No,"$5,000+",$100 - $149 / hr,10 - 49,"London, United Kingdom","Web Design,Content Marketing,Digital Strategy,Marketing Strategy,Search Engine Optimization,Web Development,Pay Per Click","15,15,15,15,15,15,10","""The relationship has been exceptional; they're proactive and never rest on their laurels.""",https://gripped.io/?utm_source=clutch.co&utm_medium=referral&utm_campaign=directory,https://clutch.co/profile/gripped
Flying V Group,Web Design,Business Growth Machines,5.0,24 REVIEWS,No,"$5,000+",$150 - $199 / hr,10 - 49,"Irvine, CA","Web Design,Pay Per Click,Search Engine Optimization,Content Marketing,Social Media Marketing","20,30,30,10,10","""We appreciate their exceptional customer service and quality conversions.""",https://www.flyingvgroup.com/website-design/?utm_source=clutch.co&utm_medium=referral&utm_campaign=web-designers,https://clutch.co/profile/flying-v-group
EWR Digital,Web Design,Full-Service Digital Marketing Agency,4.9,7 REVIEWS,No,"$5,000+",$150 - $199 / hr,10 - 49,"Houston, TX","Web Design,Search Engine Optimization,Digital Strategy,Pay Per Click,Video Production","20,35,20,15,10",“They tell me about new changes in the IT and SEO markets and I feel like I'm getting fresh ideas.”,https://www.ewrdigital.com/,https://clutch.co/profile/ewr-digital
Soto Group,Web Design,Experts in growth centric branding and web design,4.8,3 REVIEWS,No,"$5,000+",$150 - $199 / hr,10 - 49,"Brunswick, Australia","Web Design,Branding,Marketing Strategy,Web Development","40,40,10,10","""Soto Group made everything easy, understandable, and professional.""",http://www.sotogroup.co/?utm_source=clutch.co&utm_medium=referral&utm_campaign=directory,https://clutch.co/profile/soto-group
Titan Growth,Web Design,ROI-Driven Strategies Backed by Technology,5.0,34 REVIEWS,No,"$1,000+",$100 - $149 / hr,50 - 249,"San Diego, CA","Web Design,Search Engine Optimization,Pay Per Click,Content Marketing","10,60,20,10","""They always seem to be one step ahead of time.""",https://www.titangrowth.com/more-traffic-more-leads-more-revenue/?utm_source=clutch.co&utm_medium=referral&utm_campaign=titan-growth-profile,https://clutch.co/profile/titan-growth
Unified Infotech,Web Design,Turning ideas into successful digital solutions,4.5,54 REVIEWS,No,"$25,000+",$50 - $99 / hr,50 - 249,"New York, NY","Web Design,Custom Software Development,Web Development","10,80,10",“They take on any challenge and quickly create requested features.”,https://www.unifiedinfotech.net/services/custom-software-development/,https://clutch.co/profile/unified-infotech
Staylime,Web Design,Magento design & development company,4.9,37 REVIEWS,No,"$5,000+",$50 - $99 / hr,10 - 49,"Redwood City, CA","Web Design,E-Commerce Development,UX/UI Design","10,80,10","""They have all done a top-tier job fulfilling all our requests and providing innovative solutions.""",https://staylime.com/?utm_source=clutch.co&utm_medium=referral&utm_campaign=directory,https://clutch.co/profile/staylime
1Brand Design,Web Design,Let's Design Your Success.,5.0,19 REVIEWS,No,"$1,000+",$100 - $149 / hr,2 - 9,"Chicago, IL","Web Design,Graphic Design,Search Engine Optimization","80,10,10","""They have excellent patience.""",https://1brand.design/?utm_source=clutch.co&utm_medium=referral&utm_campaign=web-designers,https://clutch.co/profile/1brand-design
Art & Science,Web Design,We create the future of brands.,4.9,40 REVIEWS,No,"$25,000+",$150 - $199 / hr,50 - 249,"Toronto, Canada","Web Design,Pay Per Click,Digital Strategy,E-Commerce Development,Search Engine Optimization","10,40,30,10,10",“The team was very communicative; they never tried to hide anything or slip in additional work.,http://www.artscience.ca/?utm_source=clutch.co&utm_medium=referral&utm_campaign=directory,https://clutch.co/profile/art-science-0
KOTA,Web Design,Bringing Brands to Life Digitally,5.0,15 REVIEWS,No,"$25,000+",$100 - $149 / hr,10 - 49,"London, United Kingdom","Web Design,Web Development,Branding,Digital Strategy,Social Media Marketing","35,30,25,5,5","""The KOTA team are experts in what they do.""",https://kota.co.uk/?utm_source=clutch.co&utm_medium=referral&utm_campaign=directory,https://clutch.co/profile/kota
Rekos Agency,Web Design,"🟢 Award-Winning, Results Oriented Digital Design",4.9,17 REVIEWS,No,"$1,000+",$50 - $99 / hr,10 - 49,"Vilnius, Lithuania","Web Design,UX/UI Design,Branding","50,30,20","""They are very flexible and adapt to our schedule - we appreciate that a lot.""",https://rekos.agency/?utm_source=clutch.co&utm_medium=referral&utm_campaign=agencies-ui-ux,https://clutch.co/profile/rekos-agency
Website Iconix,Web Design,#1 Website Design & Ecommerce Agency,5.0,17 REVIEWS,No,"$1,000+",< $25 / hr,50 - 249,"Sugar Land, TX","Web Design,Web Development,E-Commerce Development","40,35,25","""I was pleased with Website Iconix and their team.""",https://www.websiteiconix.com/?utm_source=clutch.co&utm_medium=referral&utm_campaign=directory,https://clutch.co/profile/website-iconix
Hueman Studio,Web Design,"People first, design second.",5.0,7 REVIEWS,No,"$1,000+",$100 - $149 / hr,2 - 9,"Rancho Cucamonga, CA","Web Design,Logo,Video Production,Branding,Graphic Design","30,30,20,10,10","""Their unique sense of modern ideals and how to mirror and improve the workspace climate are impressive.""",https://www.huemanstudio.com/,https://clutch.co/profile/hueman-studio
BigOrange.Marketing,Web Design,Get Leads and Grow.,4.9,10 REVIEWS,No,"$25,000+",$100 - $149 / hr,10 - 49,"Cincinnati, OH","Web Design,Digital Strategy,Content Marketing,Email Marketing,Pay Per Click,Search Engine Optimization","25,25,20,10,10,10",“They strive to tell a story and engage with people by creating a message that resonates well with them.”,https://bigorange.marketing/?utm_source=clutch.co&utm_medium=referral&utm_campaign=web-designers,https://clutch.co/profile/bigorangemarketing
FlowState Branding,Web Design,Strategy by design to shape brands for greatness,4.9,33 REVIEWS,No,Undisclosed,Undisclosed,10 - 49,"Denver, CO","Web Design,Branding,Advertising,Digital Strategy,Packaging Design","20,50,10,10,10","""FlowState Branding was, dare I say it, the most creative agency I worked with in my 20-year career.""",https://flowstatebranding.com/brand-design-agency-clutch/?utm_source=clutch.co&utm_medium=referral&utm_campaign=top-30-web-design,https://clutch.co/profile/flowstate-branding
Oyova,Web Design,More Business For Your Business Is Our Business.™,4.9,103 REVIEWS,No,"$5,000+",$100 - $149 / hr,10 - 49,"Jacksonville Beach, FL","Web Design,Custom Software Development,Web Development,Digital Strategy,E-Commerce Development,Search Engine Optimization,Social Media Marketing","10,25,20,15,10,10,10","""Their consistency, responsiveness, and friendly and clear communication truly drive progress forward.""",https://www.oyova.com/?utm_source=clutch.co&utm_medium=referral&utm_campaign=directory,https://clutch.co/profile/oyova
Fat Cow Media,Web Design,Creative web design & SEO agency,4.9,25 REVIEWS,No,"$5,000+",$50 - $99 / hr,2 - 9,"London, United Kingdom","Web Design,Search Engine Optimization,Branding,Web Development","40,40,10,10",“Fat Cow Media’s communication was their biggest strength — they went above and beyond for us.”,https://fatcowmedia.co.uk/?utm_source=clutch.co/&utm_medium=referral&utm_campaign=web-design-agencies,https://clutch.co/profile/fat-cow-media
Axisbits GmbH,Web Design,#1 Web Developers on Clutch Switzerland,5.0,38 REVIEWS,No,"$10,000+",$50 - $99 / hr,10 - 49,"Zürich, Switzerland","Web Design,Web Development,Mobile App Development","30,50,20","""The efficient communication and the input of their own creative ideas were impressive.""",https://axisbits.com/?utm_source=clutch&utm_medium=referral&utm_campaign=web-designers,https://clutch.co/profile/axisbits-gmbh
aStash,Web Design,Rocket Your Rankings,5.0,12 REVIEWS,No,"$1,000+",$100 - $149 / hr,10 - 49,"Fort Collins, CO","Web Design,Search Engine Optimization","35,65","""Their hard work and attention to detail set them apart.""",https://www.astash.com/,https://clutch.co/profile/astash
GrayCyan,Web Design,"AWS & IBM Partner - Laravel, PHP, WordPress",4.8,72 REVIEWS,No,"$10,000+",$100 - $149 / hr,10 - 49,"Wilmington, DE","Web Design,Custom Software Development,Web Development,AI Development","35,40,15,10","""They successfully customized their operating, design, and communication style to my preferences.""",https://www.graycyan.com/?utm_source=clutch.co&utm_medium=referral&utm_campaign=web-design-global,https://clutch.co/profile/graycyan
Aspire Digital Solutions,Web Design,"Digital Marketing Success, Tailored Just for You",4.9,28 REVIEWS,No,"$5,000+",$100 - $149 / hr,2 - 9,"Ridgefield, CT","Web Design,Search Engine Optimization,Pay Per Click,Advertising,Email Marketing,Social Media Marketing","25,25,20,10,10,10","""Whenever we need anything or have questions, they are always available and willing to help.""",https://aspiredigitalsolutions.com/contact/?utm_source=clutch.co&utm_medium=referral,https://clutch.co/profile/aspire-digital-solutions
Jacob Tyler,Web Design,We are a global integrated brand experience agency,4.9,59 REVIEWS,No,"$5,000+",$150 - $199 / hr,10 - 49,"Del Mar, CA","Web Design,Advertising,Branding,Digital Strategy,Email Marketing,Logo,Search Engine Optimization","20,20,20,10,10,10,10","“Jacob Tyler has been flexible around our needs. Whatever we ask them for, they’re very willing to help us get it done.”",http://www.jacobtyler.com/?utm_source=clutch&utm_medium=referral,https://clutch.co/profile/jacob-tyler
edgeBD Inc.,Web Design,creative by design,5.0,6 REVIEWS,No,"$5,000+",$100 - $149 / hr,2 - 9,"Oakville, Canada","Web Design,UX/UI Design,Branding","60,25,15","""They’re highly professional and consistently responsive.""",https://edgebd.ca/,https://clutch.co/profile/edgebd
Flatirons,Web Design,Top Web & Mobile Development Company,5.0,23 REVIEWS,No,"$50,000+",$50 - $99 / hr,10 - 49,"Boulder, CO","Web Design,Web Development,Mobile App Development,Custom Software Development,IT Staff Augmentation,UX/UI Design","10,40,20,10,10,10","""It was truly a pleasure to collaborate with everyone on the team.""",https://flatirons.com/?utm_source=clutch.co&utm_medium=referral,https://clutch.co/profile/flatirons
Massive Media,Web Design,The future favours the bold.,5.0,19 REVIEWS,No,"$25,000+",$150 - $199 / hr,10 - 49,"Vancouver, Canada","Web Design,Branding,E-Commerce Development,Other Digital Marketing","40,40,10,10","""We really appreciated their energy and vibe. From start to finish, their curiosity and enthusiasm really shone through…""",http://engagemassive.com/?utm_source=clutch.co&utm_medium=referral,https://clutch.co/profile/massive-media
Seota Digital Marketing,Web Design,"Robust SEO, Stunning Web Design, Expert Developers",5.0,23 REVIEWS,No,"$10,000+",$100 - $149 / hr,10 - 49,"Frisco, TX","Web Design,Web Development,Search Engine Optimization,Digital Strategy","30,35,30,5","""They worked on our project quickly without letting quality suffer.""",https://seota.com/?utm_source=clutch.co&utm_medium=referral,https://clutch.co/profile/seota-digital-marketing
Rouge Media,Web Design,Rouge Media - The B2B Web Design Agency ⭐️⭐️⭐️⭐️⭐,5.0,5 REVIEWS,No,"$10,000+",$50 - $99 / hr,10 - 49,"Reading, United Kingdom","Web Design,Web Development,Branding","45,45,10","""They’ve been a great partner to our business and this partnership has made a big impact on the company.""",https://rouge-media.com/?utm_source=clutch.co&utm_medium=referral&utm_campaign=web-designers,https://clutch.co/profile/rouge-media-0
Digital Butlers,Web Design,"Award-winning 🏆 studio, loyal to your vision.",4.9,21 REVIEWS,No,"$5,000+",$50 - $99 / hr,10 - 49,"Limassol, Cyprus","Web Design,Web Development,UX/UI Design","20,60,20","""They spent hundreds of hours designing, building, and polishing the website to perfection.""",https://digitalbutlers.team/?utm_source=clutch&utm_medium=profile&utm_campaign=page,https://clutch.co/profile/digital-butlers
eobiont,Web Design,strategic marketing and design agency,4.9,6 REVIEWS,No,"$10,000+",$100 - $149 / hr,10 - 49,"Berlin, Germany","Web Design,Branding,Web Development,Graphic Design,Marketing Strategy,Pay Per Click,Social Media Marketing","20,20,20,10,10,10,10","""It was not about what we liked or what eobiont liked — the focus was always on what the customer needed.""",https://www.eobiont.com/,https://clutch.co/profile/eobiont
Tegan Digital,Web Design,"A digital-first, full-service agency",5.0,12 REVIEWS,No,"$25,000+",$150 - $199 / hr,10 - 49,"Addison, TX","Web Design,Digital Strategy,Advertising,Branding,Web Development,Marketing Strategy,Mobile & App Marketing,Social Media Marketing","20,20,15,15,15,5,5,5","""The process went very smoothly, and we plan to work with them again whenever a need arises.""",https://tegan.io/?utm_source=clutch.co&utm_medium=referral&utm_campaign=web-designers,https://clutch.co/profile/tegan-digital
Ayokay,Web Design,Web Design & Digital Marketing Agency,5.0,7 REVIEWS,No,"$1,000+",$100 - $149 / hr,10 - 49,"Indianapolis, IN","Web Design,Web Development,Search Engine Optimization,Branding,Digital Strategy,Email Marketing","25,25,20,10,10,10","""They give us the same priority as their larger clients which gives us the ability to keep positively growing.""",https://www.ayokay.com/get-started/?utm_source=clutch.co&utm_medium=referral&utm_campaign=directory,https://clutch.co/profile/ayokay
C7 Apps + Websites + Marketing,Web Design,Florida's Best All-In-One Marketing Agency,5.0,17 REVIEWS,No,"$1,000+",$100 - $149 / hr,10 - 49,"Jacksonville, FL","Web Design,Mobile App Development,Search Engine Optimization,Web Development,Video Production","30,30,15,15,10","""They delivered on time.""",https://www.c7creative.com/web-design-jacksonville/?utm_source=clutch.co&utm_medium=referral&utm_campaign=web-designers,https://clutch.co/profile/c7-apps-websites-marketing
Durkan Group,Web Design,Listen. Create. Elevate.,4.8,9 REVIEWS,No,"$75,000+",$150 - $199 / hr,10 - 49,"Malvern, PA","Web Design,Web Development,Branding,UX/UI Design","30,40,15,15","""Their ability to deliver everything we asked for on time was outstanding.""",https://durkangroup.com/?utm_source=clutch.co&utm_medium=referral&utm_campaign=directory,https://clutch.co/profile/durkan-group
Urban Insight,Web Design,"⭐️⭐️⭐️⭐️⭐️ Web Strategy, Design & Development",5.0,30 REVIEWS,No,"$50,000+",$150 - $199 / hr,10 - 49,"Los Angeles, CA","Web Design,Web Development,UX/UI Design","10,80,10","  ""They can work with you to evolve your brand such that you don’t have to stick with one design option.",https://urbaninsight.com/?utm_source=clutch.co&utm_medium=referral&utm_campaign=web-designers,https://clutch.co/profile/urban-insight
micro1,Web Design,"World-class software engineers, powered by AI",4.9,59 REVIEWS,No,"$25,000+",$50 - $99 / hr,50 - 249,"Los Angeles, CA","Web Design,Web Development,IT Staff Augmentation,Mobile App Development","10,70,10,10",“They always make sure that we're well taken care of.”,https://micro1.ai/clutch-microlab/?utm_source=clutch.co&utm_medium=referral&utm_campaign=web-designers,https://clutch.co/profile/micro1
DevriX,Web Design,The WordPress Retainers Company,4.8,10 REVIEWS,No,"$10,000+",$100 - $149 / hr,50 - 249,"Sofia, Bulgaria","Web Design,Web Development,Digital Strategy,Custom Software Development","25,45,20,10","""DevriX knows the market better than anyone else.""",https://devrix.com/?utm_source=clutch.co&utm_medium=referral&utm_campaign=directory,https://clutch.co/profile/devrix
Crushing Cones,Web Design,You have big ideas. We bring them to life.,5.0,3 REVIEWS,No,"$1,000+",$50 - $99 / hr,2 - 9,"Toronto, Canada","Web Design,UX/UI Design,Search Engine Optimization,Web Development","60,20,10,10","""There’s nothing they can’t do.""",https://crushingcones.com/?utm_source=clutch.co&utm_medium=referral&utm_campaign=directory,https://clutch.co/profile/crushing-cones
J2,Web Design,Building Brands with Purpose,4.9,15 REVIEWS,No,"$50,000+",$150 - $199 / hr,10 - 49,"Philadelphia, PA","Web Design,Branding,Advertising,Video Production","20,45,25,10","""I would recommend J2 to any organization — they're excellent!""",https://j2made.com/?utm_source=clutch.co&utm_medium=referral&utm_campaign=directory,https://clutch.co/profile/j2
True Market,Web Design,Performance Driven Websites,4.8,16 REVIEWS,No,"$5,000+",$100 - $149 / hr,2 - 9,"Calgary, Canada","Web Design,Branding,E-Commerce Development,Graphic Design,Search Engine Optimization,Web Development","50,10,10,10,10,10","""Their design abilities were amazing and very thoughtful.""",https://truemarket.ca/?utm_source=Clutch&utm_medium=referral&utm_campaign=clutch_truemarket_profile,https://clutch.co/profile/true-market
Brave Factor,Web Design,Digital agency for nonprofits & social enterprises,5.0,25 REVIEWS,No,"$25,000+",$100 - $149 / hr,2 - 9,"Pemogan, Denpasar Selatan, Bali, Indonesia","Web Design,Web Development,Digital Strategy,Graphic Design,UX/UI Design","30,30,20,10,10","""They stuck to the timelines as much as possible and were very responsive and patient with us.""",https://bravefactor.com/?utm_source=clutch.co&utm_medium=referral&utm_campaign=web-designers,https://clutch.co/profile/brave-factor
yumeda studio,Web Design,Clear Strategy Creative Design,5.0,10 REVIEWS,No,"$10,000+",$50 - $99 / hr,10 - 49,"Weinheim, Germany","Web Design,Branding,Digital Strategy,UX/UI Design,Web Development","20,20,20,20,20","""The communication went smoothly via Slack, and changes were quickly implemented.""",https://yumeda.de/?utm_source=clutch.co&utm_medium=referral&utm_campaign=directory,https://clutch.co/profile/yumeda-studio
Gumas,Web Design,San Francisco Marketing and Creative Agency,5.0,5 REVIEWS,No,"$5,000+",$100 - $149 / hr,10 - 49,"San Francisco, CA","Web Design,Branding,Advertising,Marketing Strategy,Social Media Marketing,Graphic Design","25,20,15,15,15,10","""Their people are first class.""",https://gumas.com/?utm_source=clutch.co&utm_medium=referral&utm_campaign=directory,https://clutch.co/profile/gumas
Fooz,Web Design,Rock-solid WordPress VIP certified developers.,4.9,35 REVIEWS,No,"$5,000+",$50 - $99 / hr,10 - 49,"Katowice, Poland","Web Design,Web Development","20,80","""Great service, can't recommend them enough.""",https://foozagency.com/?utm_source=clutch.co&utm_medium=referral,https://clutch.co/profile/fooz
