Name,Type of Agency,Tagline,Ratings,Reviews,Sponsor,MinProjectSize,HourlyRate,TeamSize,Location,ServiceNames,ServicePercentages,Feedback,WebsiteLink,ClutchDirectoryLink
TekRevol,Web Design,Digital Transformation Company,4.8,67 REVIEWS,No,"$25,000+",$50 - $99 / hr,250 - 999,"Houston, TX","Web Design,Mobile App Development,Custom Software Development,Web Development,Blockchain","10,45,30,10,5","“They’re experienced, knowledgeable, and resourceful.”",https://www.tekrevol.com/?utm_source=clutch-referrer&utm_medium=clutch-profile&utm_campaign=clutch&utm_id=clutch,https://clutch.co/profile/tekrevol
Developer Bazaar Technologies,Web Design,"Top Web Design, Software & Mobile App Development",4.9,16 REVIEWS,No,"$1,000+",$25 - $49 / hr,10 - 49,"Indore, India","Web Design,Web Development,Custom Software Development,Mobile App Development","40,25,20,15",''The project management was professional.'',https://www.developerbazaar.com/landing-page/?utm_source=clutch&utm_medium=clutch&utm_campaign=clutch_users,https://clutch.co/profile/developer-bazaar-technologies
Five Jars,Web Design,⭐️⭐️⭐️⭐️⭐️ OUTSTANDING WEB DESIGN & DEVELOPMENT,4.9,25 REVIEWS,No,"$10,000+",$100 - $149 / hr,10 - 49,"Brooklyn, NY","Web Design,Web Development,UX/UI Design,Custom Software Development,Search Engine Optimization","20,60,10,5,5","""Five Jars is truly the best website development and support partner I have worked with.""",https://fivejars.com/services/design?utm_source=clutch.co&utm_medium=referral&utm_campaign=web-designers,https://clutch.co/profile/five-jars
Thinkbound Inc.,Web Design,Get to breakthrough,4.8,13 REVIEWS,No,"$10,000+",$100 - $149 / hr,2 - 9,"Toronto, Canada","Web Design,Web Development","70,30","""They value their work and deliver the best quality at the best price.""",https://www.thinkbound.com/?utm_source=clutch.co&utm_medium=referral&utm_campaign=directory,https://clutch.co/profile/thinkbound
Chromatix,Web Design,#1 Websites That Make Your Phone Ring - Est. 2009,5.0,9 REVIEWS,No,"$5,000+",$150 - $199 / hr,10 - 49,"Canterbury, Australia","Web Design,Web Development,Digital Strategy,E-Commerce Development,Other Digital Marketing,UX/UI Design","30,30,10,10,10,10","""They helped and over-delivered in a lot of ways.""",https://www.chromatix.com.au/?utm_source=clutch.co&utm_medium=referral&utm_campaign=directory,https://clutch.co/profile/chromatix
SmartSites,Web Design,Think Web. Think Smart. 💡,5.0,163 REVIEWS,No,"$1,000+",$100 - $149 / hr,250 - 999,"Paramus, NJ","Web Design,Pay Per Click,Search Engine Optimization,Advertising,Social Media Marketing","10,35,35,10,10","""They are amazing in all aspects.""",https://www.smartsites.com/lp/digital-marketing-lp/?utm_source=clutch.co&utm_medium=referral,https://clutch.co/profile/smartsites
The Story Web Design,Web Design,Sensational Websites for Business Impact,5.0,31 REVIEWS,No,"$5,000+",$100 - $149 / hr,2 - 9,"Toronto, Canada","Web Design,Web Development,Branding,Marketing Strategy","55,25,10,10","""The Story really helped us understand what was possible and made changes quickly and efficiently.""",https://thestorywebs.com/?utm_source=clutch&utm_medium=r&utm_campaign=w&utm_id=top50c,https://clutch.co/profile/story-web-design
Outliant,Web Design,We bring visionary ideas to life,5.0,18 REVIEWS,No,"$50,000+",$150 - $199 / hr,50 - 249,"Austin, TX","Web Design,Custom Software Development,Web Development,Digital Strategy,Mobile App Development,UX/UI Design","20,25,20,15,10,10","""They are the most reliable and efficient software development company I’ve worked with.""",https://outliant.com/?utm_source=clutch.co&utm_medium=referral&utm_campaign=directory,https://clutch.co/profile/outliant
PixelChefs,Web Design,Building Your Business One Byte At A Time.,5.0,7 REVIEWS,No,"$10,000+",$100 - $149 / hr,2 - 9,"Winter Garden, FL","Web Design,Search Engine Optimization","50,50","""They were personable and understanding of what we wanted to accomplish.""",https://www.pixelchefs.com/?utm_source=clutch.co&utm_medium=referral&utm_campaign=directory,https://clutch.co/profile/pixelchefs
WEBO Digital,Web Design,Creating Intuitive Customer Experiences,4.9,22 REVIEWS,No,"$10,000+",$50 - $99 / hr,50 - 249,"Perth, Australia","Web Design,Custom Software Development,Web Development,E-Commerce Development,Mobile App Development,UX/UI Design","25,25,20,10,10,10","""I'm impressed with their ability to figure stuff out and make things work."" """,https://webo.digital/?utm_source=clutch.co&utm_medium=referral&utm_campaign=directory,https://clutch.co/profile/webo-digital
Savas Labs,Web Design,Designing and developing elegant web products.,5.0,29 REVIEWS,No,"$25,000+",$150 - $199 / hr,10 - 49,"Raleigh, NC","Web Design,Web Development,Mobile App Development,Custom Software Development,Digital Strategy","20,35,25,10,10",“Savas Labs is amazing at translating business issues into technology solutions.”,https://www.savaslabs.com/,https://clutch.co/profile/savas-labs
"RainCastle Communications, Inc.",Web Design,"Web Design and Branding Agency, Newton MA",4.9,40 REVIEWS,No,"$10,000+",$150 - $199 / hr,2 - 9,"Needham, MA","Web Design,Branding,Graphic Design","50,40,10","""They did an amazing job of translating a really technical subject matter in a creative and digestible way.""",http://www.raincastle.com/?utm_source=clutch.co&utm_medium=referrall&utm_campaign=web-designers,https://clutch.co/profile/raincastle-communications
Studio Fox Design,Web Design,Website Design and E-Commerce for Small Business,5.0,15 REVIEWS,No,"$1,000+",$100 - $149 / hr,2 - 9,"Dallas, TX",Web Design,100,"""They took the time to understand our vision and goals and provided valuable input and suggestions.""",https://www.studiofoxdesign.com/?utm_source=clutch.co&utm_medium=referral&utm_campaign=web-designers,https://clutch.co/profile/studio-fox-design
The Branx,Web Design,The #1 Tech-Startup Branding Agency,5.0,18 REVIEWS,No,"$10,000+",$50 - $99 / hr,2 - 9,"Cádiz, Spain","Web Design,Branding,Video Production","35,55,10","""They took our business goals as serious constraints that they designed around.""",https://thebranx.com/services/web-design-startup?utm_source=clutch.co&utm_medium=referral&utm_campaign=web-designers,https://clutch.co/profile/branx
eSEOspace,Web Design,Custom Website Design + SEO,5.0,13 REVIEWS,No,"$1,000+",$50 - $99 / hr,10 - 49,"San Diego, CA","Web Design,Search Engine Optimization","50,50","""I was delighted with their responsiveness and quality delivery.""",https://eseospace.com/?utm_source=clutch.co&utm_medium=referral&utm_campaign=web-designers,https://clutch.co/profile/eseospace
The Weather,Web Design,"Websites, Branding & Digital Marketing",4.9,25 REVIEWS,No,"$1,000+",$50 - $99 / hr,10 - 49,"Berlin, Germany","Web Design,Web Development,E-Commerce Development","40,40,20","""They helped me with everything I wanted, starting with the right direction of the design to communicate without words.""",https://theweather.agency/?utm_source=clutch.co&utm_medium=referral&utm_campaign=web-designers,https://clutch.co/profile/weather
ThreeSixtyEight,Web Design,Challenge common thinking,4.9,45 REVIEWS,No,"$75,000+",$150 - $199 / hr,10 - 49,"Baton Rouge, LA","Web Design,Marketing Strategy,Branding,UX/UI Design,Advertising","30,25,20,15,10","""Working with ThreeSixtyEight has been transformational rather than transactional.""",https://www.threesixtyeight.com/?utm_source=clutch.co&utm_medium=referral,https://clutch.co/profile/threesixtyeight
SeekThem™,Web Design,Award-Winning Design & Branding Firm on Clutch!,5.0,37 REVIEWS,No,"$10,000+",$150 - $199 / hr,10 - 49,"London, United Kingdom","Web Design,Logo,Graphic Design","40,40,20","""They promptly addressed any queries or adjustments we had and ensured that the website was launched on time.""",https://seekthem.com/?utm_source=clutch.co&utm_medium=referral&utm_campaign=web-designers,https://clutch.co/profile/seekthem
Intero Digital,Web Design,#1 Rated Digital Marketing Agency in the US,4.9,123 REVIEWS,No,"$1,000+",$100 - $149 / hr,250 - 999,"Colorado Springs, CO","Web Design,Search Engine Optimization,Content Marketing,Digital Strategy,Pay Per Click,Social Media Marketing,Video Production","10,40,10,10,10,10,10","""They are eager to help in any way they can.""",https://www.interodigital.com/meet-intero-digital-landing/?utm_source=clutch&utm_medium=referral&utm_campaign=intero-digital-profile,https://clutch.co/profile/intero-digital-0
Social Driver,Web Design,Experience digital with us.,4.9,67 REVIEWS,No,"$25,000+",$150 - $199 / hr,10 - 49,"Washington, DC","Web Design,Social Media Marketing,Web Development,Advertising,Branding,UX/UI Design,Video Production","15,30,15,10,10,10,10","“They’re hyper-client-centric, so they always try to do what’s best for us.”",http://www.socialdriver.com/?utm_source=clutch.co&utm_medium=referral&utm_campaign=directory,https://clutch.co/profile/social-driver
Pragmatica,Web Design,The Web Developer You Can Trust,5.0,23 REVIEWS,No,"$5,000+",$100 - $149 / hr,2 - 9,"Vancouver, Canada","Web Design,Web Development","50,50","""Pragmatica (formerly Plentitud) was very engaged and responsive to our concerns and requests. I would highly recommend…""",https://pragmati.ca/?utm_source=clutch.co&utm_medium=referral&utm_campaign=directory,https://clutch.co/profile/pragmatica
Exore LTD,Web Design,🌟 Innovative Custom Solutions,4.9,8 REVIEWS,No,"$10,000+",$50 - $99 / hr,10 - 49,"Warszawa, Poland","Web Design,Web Development,Custom Software Development","70,20,10","""We were happy with the finished product.""",https://exore.pro/?utm_source=clutch.co&utm_medium=referral&utm_campaign=directory-webdesignsmallbusiness,https://clutch.co/profile/exore
Paper Tiger,Web Design,Marketers Love Us,4.9,18 REVIEWS,No,"$10,000+",$150 - $199 / hr,10 - 49,"Ridgewood, NJ","Web Design,Branding,Web Development","40,30,30","""They were incredibly flexible to our working style.""",https://www.papertiger.com/?utm_campaign=attract&utm_source=referral&utm_medium=profile&utm_term=clutch&utm_content=direct,https://clutch.co/profile/paper-tiger
Quixta,Web Design,Transforming Clicks into Clients,4.8,9 REVIEWS,No,"$1,000+",< $25 / hr,10 - 49,"Bengaluru, India","Web Design,E-Commerce Development,Search Engine Optimization,Web Development","40,20,20,20","""Their prompt response to our queries and willingness to fulfill our needs have ensured everything runs smoothly.""",https://www.quixta.in/?utm_source=clutch.co&utm_medium=referral&utm_campaign=directory,https://clutch.co/profile/quixta
The Future Forward Inc.,Web Design,Helping brands achieve greater influence.,4.9,13 REVIEWS,No,"$10,000+",$150 - $199 / hr,10 - 49,"Brooklyn, NY","Web Design,Branding,Web Development","40,40,20","""They understood our goals and genuinely blended well with our team.""",https://thefutureforward.com/?utm_source=clutch.co&utm_medium=referral&utm_campaign=directory,https://clutch.co/profile/future-forward
Big Red Jelly,Web Design,Brand. Build. Grow.,4.8,95 REVIEWS,No,"$5,000+",$200 - $300 / hr,10 - 49,"Provo, UT","Web Design,Branding,Marketing Strategy","40,40,20","""Everyone was genuinely helpful and just really wonderful to work with!""",https://bigredjelly.com/,https://clutch.co/profile/big-red-jelly
Idea Grove,Web Design,Growing Your Business with Trust,4.9,28 REVIEWS,No,"$10,000+",$150 - $199 / hr,10 - 49,"Dallas, TX","Web Design,Public Relations,Branding,Content Marketing,Digital Strategy","20,30,20,20,10",“They delivered on all fronts and did everything they said they would do during the RFP process.,https://www.ideagrove.com/clutch,https://clutch.co/profile/idea-grove
Embark,Web Design,A web agency made for small business + nonprofits.,5.0,10 REVIEWS,No,"$5,000+",$150 - $199 / hr,2 - 9,"Corona, CA","Web Design,Web Development,Other Digital Marketing,Branding","40,25,20,15","""We would hire Embark again, many times over!""",https://embarkwork.com/?utm_source=clutch.co&utm_medium=referral&utm_campaign=directory,https://clutch.co/profile/embark
MBLM,Web Design,The Brand Intimacy Agency,5.0,10 REVIEWS,No,"$10,000+",$100 - $149 / hr,50 - 249,"New York, NY","Web Design,Branding,Logo,Graphic Design","15,60,15,10","""MBLM consistently met their promises and delivered above and beyond expectations.""",http://mblm.com/?utm_source=clutch.co&utm_medium=referral&utm_campaign=directory,https://clutch.co/profile/mblm
Vrrb Interactive,Web Design,"Branding, Design, Development, + Marketing",4.7,6 REVIEWS,No,"$25,000+",$100 - $149 / hr,10 - 49,"Los Angeles, CA","Web Design,Web Development,Branding","40,40,20",“We’re highly satisfied with their work.”,http://www.vrrb.com/?utm_source=clutch&utm_medium=referral,https://clutch.co/profile/vrrb-interactive
GLO - Generate Leads Online,Web Design,Helping You Generate Leads Online,4.9,24 REVIEWS,No,"$1,000+",$50 - $99 / hr,10 - 49,"Ipswich, United Kingdom","Web Design,Pay Per Click,Search Engine Optimization,Sales Outsourcing,Social Media Marketing","30,20,20,15,15",“GLO has delivered exactly what I asked for; they’ve basically gotten the project 100% correct.,https://generateleads.online/design-and-development/seo-web-design/?utm_source=clutch.co&utm_medium=referral&utm_campaign=web-designers,https://clutch.co/profile/glo-generate-leads-online
Agency Partner Interactive LLC,Web Design,Discover Your Competitive Advantage,4.9,53 REVIEWS,No,"$5,000+",$25 - $49 / hr,50 - 249,"Dallas, TX","Web Design,Custom Software Development,E-Commerce Development,Mobile App Development,Web Development","20,20,20,20,20","""Overall, they took the time to understand what we were trying to build and how to ensure a great customer experience.""",https://agencypartner.com/contact-us/?utm_source=clutch&utm_medium=profile&utm_campaign=directory_listing,https://clutch.co/profile/agency-partner-interactive-0
Perpetual,Web Design,Build your vision with us,4.8,70 REVIEWS,No,"$25,000+",$50 - $99 / hr,50 - 249,"New York, NY","Web Design,UX/UI Design,Web Development,Custom Software Development,Mobile App Development,Other","15,30,30,10,10,5","""Everyone I work with is sharp, organized, and willing to work and go the extra mile."" """,https://perpetualny.com/capabilities/ux-and-design?utm_source=clutch.co&utm_medium=referral&utm_campaign=web-designers,https://clutch.co/profile/perpetual
Create Ape,Web Design,Full service UX and development agency,4.8,53 REVIEWS,No,"$5,000+",$100 - $149 / hr,10 - 49,"Irvine, CA","Web Design,UX/UI Design,Product Design,Web Development","30,40,20,10","""We've had many developers drop the ball on website launches, but CreateApe consistently worked out any kinks quickly.""",https://createape.com/clutch/?utm_source=clutch.co&utm_medium=referral&utm_campaign=web-designers,https://clutch.co/profile/create-ape
Fisher Agency,Web Design,Results-Driven Marketing Agency,4.8,6 REVIEWS,No,"$1,000+",$150 - $199 / hr,10 - 49,"Jacksonville, FL","Web Design,Branding,Advertising,Marketing Strategy","50,25,15,10","""We highly recommend them to anyone that is in need or looking for web design work.""",https://www.fisherdesignandadvertising.com/?utm_source=clutch.co&utm_medium=referral&utm_campaign=directory#/home,https://clutch.co/profile/fisher-agency
ONE18MEDIA,Web Design,Grow Your Audience. Build Your Brand.,5.0,7 REVIEWS,No,"$10,000+",$150 - $199 / hr,2 - 9,"Melville, NY","Web Design,Digital Strategy,Pay Per Click,Search Engine Optimization,Content Marketing","40,20,15,15,10","""ONE18MEDIA provided incredible results with the finished project that met all of our goals.""",https://landing.one18media.com/?utm_source=clutch.co&utm_medium=referral&utm_campaign=web-designers,https://clutch.co/profile/one18media
Double Up Digital,Web Design,Building Web Presences That Generate Revenue,4.8,6 REVIEWS,No,"$5,000+",$100 - $149 / hr,2 - 9,"Dunwoody, GA","Web Design,Digital Strategy,Conversion Optimization,Search Engine Optimization","50,30,10,10","""Double Up Digital’s communication and graphic design skills are impressive.""",https://doubleup.digital/?utm_source=clutch.co&utm_medium=referral,https://clutch.co/profile/double-digital
Modern Tribe,Web Design,Digital solutions that empower people & platforms.,4.9,5 REVIEWS,No,"$50,000+",$200 - $300 / hr,50 - 249,"Minneapolis, MN","Web Design,Web Development,E-Commerce Development,UX/UI Design","30,35,20,15","“During every stage of the project, they’ve been a dream team to work with.”",https://tri.be/?utm_source=clutch.co&utm_medium=referral&utm_campaign=directory,https://clutch.co/profile/modern-tribe
Digis,Web Design,"Certified Experts, Patented Excellence",4.8,60 REVIEWS,No,"$5,000+",$25 - $49 / hr,50 - 249,"New York, NY","Web Design,Custom Software Development,Mobile App Development,Web Development,AI Development,IT Strategy Consulting","15,20,20,20,15,10","""I pushed them hard, and they responded with incredible work ethic, quality, and delivery.""",https://digiscorp.com/?utm_source=clutch.co&utm_medium=referral&utm_campaign=directory,https://clutch.co/profile/digis
Ramotion,Web Design,"Digital product agency: Branding, Web, UI/UX",4.9,28 REVIEWS,No,"$50,000+",$100 - $149 / hr,10 - 49,"San Francisco, CA","Web Design,Branding,UX/UI Design","35,50,15",“I was most impressed with Ramotion’s attention to detail.”,https://www.ramotion.com/?utm_source=clutch.co&utm_medium=referral&utm_campaign=directory,https://clutch.co/profile/ramotion
97 Switch,Web Design,"Marketing, design, and strategy",5.0,28 REVIEWS,No,"$10,000+",$150 - $199 / hr,2 - 9,"Chicago, IL","Web Design,Social Media Marketing,Branding,Digital Strategy,Pay Per Click,Search Engine Optimization","35,25,10,10,10,10","""Their team is a top-notch group of highly creative individuals.""",https://97switch.com/?utm_source=clutch.co&utm_medium=referral&utm_campaign=directory,https://clutch.co/profile/97-switch
tagDiv,Web Design,Web Development & Design Solutions for Business,4.9,18 REVIEWS,No,"$1,000+",$50 - $99 / hr,10 - 49,"Alba Iulia, Romania","Web Design,Web Development,Custom Software Development","35,35,30","""We had some lofty ideas that seemed out of budget and scope, and they always delivered excellently.""",https://tagdiv.com/?utm_source=clutch.co&utm_medium=referral&utm_campaign=web-designers,https://clutch.co/profile/tagdiv
Scopic,Web Design,Custom Software Development to Drive Success,4.9,59 REVIEWS,No,"$10,000+",$25 - $49 / hr,50 - 249,"Rutland, MA","Web Design,Web Development,Custom Software Development,Mobile App Development,AI Development","10,50,15,15,10",“They were accommodating of the changes in the scope and flexible in meeting our vision for the final product.”,https://scopicsoftware.com/design/?utm_source=clutch.co&utm_medium=referral&utm_campaign=web-designers,https://clutch.co/profile/scopic-0
Atoll Digital,Web Design,We create visually powerful & intuitive websites.,5.0,4 REVIEWS,No,"$25,000+",$150 - $199 / hr,2 - 9,"Montréal, Canada","Web Design,Web Development","50,50","""Their personal touch with the project and great communication were impressive.""",https://atolldigital.com/?utm_source=clutch.co&utm_medium=referral&utm_campaign=directory,https://clutch.co/profile/atoll-digital
WP Pals,Web Design,Your Website Support Pals!,4.9,24 REVIEWS,No,"$5,000+",$50 - $99 / hr,10 - 49,"Houston, TX","Web Design,Mobile App Development,Web Development,E-Commerce Development","40,30,20,10",“Their personalities are excellent. We deal with people that we like and trust.”,https://wppals.com/web-design/?utm_source=clutch.co&utm_medium=referral&utm_campaign=web-designers,https://clutch.co/profile/wp-pals
PageTraffic,Web Design,"India's top SEO, Digital Marketing Company",4.7,29 REVIEWS,No,"$1,000+",< $25 / hr,50 - 249,"New Delhi, India","Web Design,Search Engine Optimization,Pay Per Click,Content Marketing,Digital Strategy,Ecommerce Marketing","25,45,15,5,5,5","""We’ve been impressed by their ability to exceed expectations and consistently deliver excellent results.""",https://www.pagetraffic.com/?utm_source=clutch.co&utm_medium=referral,https://clutch.co/profile/pagetraffic
Absolute Web,Web Design,"Full Service eCommerce Agency (based in Miami, FL)",4.9,77 REVIEWS,No,"$10,000+",$100 - $149 / hr,50 - 249,"Miami, FL","Web Design,E-Commerce Development,Web Development,Email Marketing,Marketing Strategy","10,50,20,10,10","""They have really listened to how we want to be branded, and seem nearly as passionate about our brand as we are.""",https://www.absoluteweb.com/?utm_source=Clutch&utm_medium=Listing&utm_campaign=WebDesign-Silver,https://clutch.co/profile/absolute-web-0
Nixtio Digital Agency,Web Design,"Web, App Development and Design, Branding",5.0,16 REVIEWS,No,"$5,000+",$50 - $99 / hr,10 - 49,"Fort Lauderdale, FL","Web Design,Branding,UX/UI Design,Web Development","55,15,15,15","""We have completely given ourselves to the professionals' hands, and we do not regret our choice now.""",https://nixtio.com/?utm_source=clutch.co&utm_medium=referral&utm_campaign=directory,https://clutch.co/profile/nixtio-digital-agency
Xhilarate,Web Design,The Arsenal of Innovation,5.0,23 REVIEWS,No,"$10,000+",$150 - $199 / hr,2 - 9,"Philadelphia, PA","Web Design,Branding,Graphic Design,Advertising","30,35,25,10","""The team is patient, and they listen to our needs.""",https://www.xhilarate.com/?utm_source=clutch.co&utm_medium=referral,https://clutch.co/profile/xhilarate
Dazze Studio,Web Design,💰 eCommerce Experts | ✏️ Design Focused | +55 🏆.,4.9,22 REVIEWS,No,"$5,000+",$50 - $99 / hr,2 - 9,"Hartlepool, United Kingdom","Web Design,E-Commerce Development","50,50","""Their communication has been excellent in helping us to understand how the process work.""",https://www.dazze.studio/?utm_source=clutch.co&utm_medium=referral&utm_campaign=directory,https://clutch.co/profile/dazze-studio
Shakuro,Web Design,"Crafting Brands, Building Apps and Websites",4.9,49 REVIEWS,No,"$10,000+",$50 - $99 / hr,50 - 249,"Lewes, DE","Web Design,Web Development,Mobile App Development,UX/UI Design","20,40,30,10","“The team's timely, cost-effective, and consistent high-caliber work sets them apart.”",https://shakuro.com/?utm_source=clutch.co&utm_medium=profile-link&utm_campaign=listing,https://clutch.co/profile/shakuro
Chatterkick,Web Design,Meaningful Connections Win The Internet,4.9,24 REVIEWS,No,"$5,000+",$100 - $149 / hr,10 - 49,"Sioux City, IA","Web Design,Social Media Marketing,Digital Strategy,Pay Per Click,Email Marketing,HR Consulting","15,30,20,15,10,10","""Chatterkick is fantastic to work with!""",http://chatterkick.com/?utm_source=clutch.co&utm_medium=referral&utm_campaign=directory,https://clutch.co/profile/chatterkick
Chaptr,Web Design,Inspiring the Inspirational,5.0,6 REVIEWS,No,"$10,000+",$150 - $199 / hr,10 - 49,"Southampton, United Kingdom","Web Design,Web Development,UX/UI Design","45,35,20","“Now that we’ve seen what Chaptr can do, we wouldn’t consider any other web development partner.”",https://chaptr.studio/?utm_source=clutch.co&utm_medium=referral&utm_campaign=directory,https://clutch.co/profile/chaptr
Bukwild,Web Design,20+ Yrs of User-First Digital for the Modern Brand,5.0,6 REVIEWS,No,"$25,000+",$200 - $300 / hr,10 - 49,"Sacramento, CA","Web Design,Digital Strategy,E-Commerce Development,UX/UI Design,Web Development","20,20,20,20,20","""They go above and beyond to learn about our goals and understand what success looks like.""",https://www.bukwild.com/?utm_source=clutch.co&utm_medium=referral&utm_campaign=directory,https://clutch.co/profile/bukwild
Chase Design,Web Design,Creating Success!,5.0,18 REVIEWS,No,"$10,000+",$150 - $199 / hr,2 - 9,"Carlsbad, CA","Web Design,Branding,Logo,Search Engine Optimization","70,10,10,10","“Chase Design was able to meet our demands ahead of schedule, and we launched the website early.”",https://chrischasedesign.com/?utm_source=clutch.co&utm_medium=referral&utm_campaign=directory,https://clutch.co/profile/chase-design
Online Optimism,Web Design,Elevate Your Online Presence.,5.0,13 REVIEWS,No,"$1,000+",$50 - $99 / hr,10 - 49,"New Orleans, LA","Web Design,Search Engine Optimization,Social Media Marketing,Web Development,Advertising,Content Marketing,Pay Per Click","20,20,20,20,10,5,5",“The quality of their work was top-notch.”,https://www.onlineoptimism.com/service/web-design/?utm_source=clutch.co&utm_medium=referral&utm_campaign=web-designers,https://clutch.co/profile/online-optimism
Motto®,Web Design,Ideas Worth Rallying Around®,5.0,13 REVIEWS,No,"$75,000+",Undisclosed,10 - 49,"New York, NY","Web Design,Branding,Business Consulting","20,50,30",“Motto®  was good at tying our business goals with our identity through brand strategy.”,https://wearemotto.com/,https://clutch.co/profile/motto
Appetite Creative,Web Design,Blockchain | Metaverse | Mobile | Web | IoT | P2E,4.7,42 REVIEWS,No,"$10,000+",$150 - $199 / hr,2 - 9,"London, United Kingdom","Web Design,Blockchain,Web Development,Graphic Design,Mobile App Development,IoT Development","30,25,20,10,10,5","""We didn't expect to get such a package deal — the level of expertise from brand design to Solana development.""",https://www.appetitecreative.com/?utm_source=clutch.co&utm_medium=referral&utm_campaign=web-design,https://clutch.co/profile/appetite-creative
Neon Rain Interactive,Web Design,Experienced web developers. Big results.,5.0,14 REVIEWS,No,"$5,000+",$100 - $149 / hr,10 - 49,"Denver, CO","Web Design,Custom Software Development,E-Commerce Development,Web Development,Mobile App Development","35,25,15,15,10","""The website is pretty much bulletproof. It works and looks great, and it was completed on time and budget.""",https://www.neonrain.com/?utm_source=clutch.co&utm_medium=referral&utm_campaign=web-designers,https://clutch.co/profile/neon-rain-interactive
