Name,Type of Agency,Tagline,Ratings,Reviews,Sponsor,MinProjectSize,HourlyRate,TeamSize,Location,ServiceNames,ServicePercentages,Feedback,WebsiteLink,ClutchDirectoryLink
Busy Human,Web Design,Making life more user-friendly,5.0,4 REVIEWS,Yes,"$1,000+",$50 - $99 / hr,2 - 9,"Orem, UT","Web Design,Mobile App Development,Web Development,Custom Software Development,E-Commerce Development,UX/UI Design","10,25,25,20,10,10","""The whole process was very smooth.""",http://busyhuman.io/?utm_source=clutch.co&utm_medium=referral&utm_campaign=directory,https://clutch.co/profile/busy-human
Sherrlinn Network,Web Design,The exquisiteness of your online presence,5.0,2 REVIEWS,Yes,"$1,000+",< $25 / hr,2 - 9,"Phalaborwa, South Africa","Web Design,E-Commerce Development,Search Engine Optimization,Social Media Marketing","60,20,10,10","""I loved what they delivered, and I’m extremely happy to work with Sherrlinn.""",https://sherrlinn.co.za/?utm_source=clutch.co&utm_medium=referral&utm_campaign=web-designers,https://clutch.co/profile/sherrlinn-network
Vrinsoft Technology,Web Design,Top Android & IOS App Development Company in India,4.8,15 REVIEWS,Yes,"$10,000+",< $25 / hr,50 - 249,"Ahmedabad, India","Web Design,Custom Software Development,Mobile App Development,Cloud Consulting & SI,IT Managed Services,Search Engine Optimization,Application Management & Support,Blockchain,Mobile & App Marketing,Web Development","15,20,15,10,10,10,5,5,5,5","""One of the most amazing about the company was their dedication to giving us exactly what we wanted.""",https://www.vrinsofts.com/?utm_source=clutch.co&utm_medium=referral&utm_campaign=directory,https://clutch.co/profile/vrinsoft-technology
Tekglide,Web Design,E-commerce Web Designing and Development Agency!,4.8,15 REVIEWS,Yes,"$10,000+",$25 - $49 / hr,50 - 249,"Darien, IL","Web Design,Web Development,E-Commerce Development,Custom Software Development,IT Staff Augmentation","10,40,30,10,10","""Their ability to quickly spin up new and knowledgeable resources positively impacted all downstream projects.""",https://tekglide.com/contact-us/?utm_source=clutch.co&utm_medium=referral&utm_campaign=clutch_profile,https://clutch.co/profile/tekglide
Pinnacle Development Solutions — Out of Business,Web Design,Your Vision with our Expertise!,4.9,6 REVIEWS,Yes,"$5,000+",$25 - $49 / hr,50 - 249,"Sunny Isles Beach, FL","Web Design,E-Commerce Development,Web Development,Cloud Consulting & SI,Custom Software Development,Ecommerce Marketing,Mobile App Development","10,20,20,15,15,10,10","""A proactive approach alongside great tech skill sets made them stand out.""",https://topdevsnow.com/?utm_source=clutch.co&utm_medium=referral&utm_campaign=directory,https://clutch.co/profile/pinnacle-development-solutions-out-business
Solid Digital,Web Design,Helping brands discover Digital Growth™,4.8,33 REVIEWS,No,"$25,000+",$150 - $199 / hr,10 - 49,"Chicago, IL","Web Design,Digital Strategy,Search Engine Optimization,UX/UI Design","70,10,10,10","""They're this really beautiful blend of design chops, process rigor, and warm personalities.""",https://www.soliddigital.com/?utm_source=clutch.co&utm_medium=referral&utm_campaign=web-designers,https://clutch.co/profile/solid-digital
Usman Group,Web Design,A boutique digital strategy and design firm.,4.9,59 REVIEWS,No,"$10,000+",$150 - $199 / hr,2 - 9,"Denver, CO","Web Design,UX/UI Design,Digital Strategy","70,20,10",“Usman Group works smarter than other companies.”,https://www.usmangroup.com/?utm_source=clutch.co&utm_medium=referral,https://clutch.co/profile/usman-group
Azuro Digital,Web Design,"Award-Winning Web Design, Development & SEO",4.9,68 REVIEWS,No,"$25,000+",$150 - $199 / hr,2 - 9,"New York, NY","Web Design,Web Development","90,10","""From the time our website launched, we have been surprised by the number of new clients that have been coming to us.""",https://azurodigital.com/?utm_source=clutch.co&utm_medium=referral&utm_campaign=web-designers,https://clutch.co/profile/azuro-digital
GLIDE®,Web Design,Results Driven Web Design & Marketing,4.9,20 REVIEWS,No,"$25,000+",$150 - $199 / hr,10 - 49,"Austin, TX","Web Design,Pay Per Click,Search Engine Optimization","70,15,15","""They knew how to specify what we were looking for and turn that into a fluent design.""",https://glidedesign.com/?utm_source=clutch.co&utm_medium=referral&utm_campaign=top-50-web-design-companies,https://clutch.co/profile/glide
3 Media Web,Web Design,Award-Winning Digital Experience Agency 🏆🏆🏆,4.9,37 REVIEWS,No,"$50,000+",$150 - $199 / hr,10 - 49,"Marlborough, MA","Web Design,Other Digital Marketing,Digital Strategy,Web Development","65,15,10,10","''Their design skills are creative, strong, and outstanding.''",https://www.3mediaweb.com/contact/?utm_source=clutch.co&utm_medium=referral,https://clutch.co/profile/3-media-web
CyberOptik,Web Design,Trusted & Reliable Web Design Agency Since 2002,4.9,55 REVIEWS,No,"$1,000+",$100 - $149 / hr,2 - 9,"Elmhurst, IL","Web Design,Pay Per Click,Search Engine Optimization","75,15,10","""They were very well organized at every step.""",https://www.cyberoptik.net/?utm_source=clutch.co&utm_medium=referral&utm_campaign=directory,https://clutch.co/profile/cyberoptik
Pronto Marketing,Web Design,Performance-Driven WordPress & SEO Agency 🚀,4.8,58 REVIEWS,No,"$1,000+",$25 - $49 / hr,50 - 249,"Seattle, WA","Web Design,Search Engine Optimization,Web Development","50,30,20","""They were a perfect fit for our business.""",https://www.prontomarketing.com/?utm_source=clutch.co&utm_medium=referral&utm_campaign=directory,https://clutch.co/profile/pronto-marketing
KrishaWeb,Web Design,Transforming Digital Experiences,5.0,45 REVIEWS,No,"$10,000+",$50 - $99 / hr,50 - 249,"Loveland, CO","Web Design,UX/UI Design,Web Development,Custom Software Development","50,20,20,10","""We are extremely satisfied with the web application developed by KrishaWeb and would highly recommend their services.""",https://krishaweb.com/?utm_source=krishaweb.com/&utm_medium=referral&utm_campaign=web-designers,https://clutch.co/profile/krishaweb
Ladybugz Interactive Agency,Web Design,Boston Website Design and Digital Growth Agency,5.0,40 REVIEWS,No,"$10,000+",$150 - $199 / hr,10 - 49,"Hudson, MA","Web Design,Other Digital Marketing,Advertising,Marketing Strategy","60,20,10,10","""We were very pleased with the website.""",http://www.ladybugz.com/?utm_source=clutch.co&utm_medium=referral&utm_campaign=directory,https://clutch.co/profile/ladybugz-interactive-agency
Thrive Design,Web Design,⭐⭐⭐⭐⭐ Grow & thrive online - Websites & SEO,5.0,27 REVIEWS,No,"$10,000+",$100 - $149 / hr,2 - 9,"Seattle, WA","Web Design,Search Engine Optimization,Branding","70,20,10","“Thrive Design is worth the money, and they’re great at what they do.”",https://thrive.design/web-design/?utm_source=clutch.co&utm_medium=referral&utm_campaign=web-designers,https://clutch.co/profile/thrive-design
Consensus Creative,Web Design,Award-Winning Web Design for Businesses & NGOs,5.0,31 REVIEWS,No,"$10,000+",$100 - $149 / hr,2 - 9,"Toronto, Canada","Web Design,Web Development","80,20","""When I surveyed the individuals who previewed the site, we had 97%–98% approval.""",https://consensuscreative.com/?utm_source=clutch.co&utm_medium=referral&utm_campaign=directory,https://clutch.co/profile/consensus-creative
Flamingo Agency,Web Design,Web Design Agency for Small Business & Nonprofits,5.0,34 REVIEWS,No,"$1,000+",$100 - $149 / hr,2 - 9,"Chicago, IL","Web Design,Search Engine Optimization,Web Development","90,5,5","''They were great, and we recommend people working with them.''",https://flamingoagency.com/?utm_source=clutch.co&utm_medium=referral&utm_campaign=web-designers,https://clutch.co/profile/flamingo-agency
Gapsy Studio,Web Design,Web & Mobile UI/UX Designer's Studio,5.0,18 REVIEWS,No,"$5,000+",$25 - $49 / hr,10 - 49,"Dnipro, Ukraine","Web Design,UX/UI Design","50,50","""They provided us with a comprehensive website design and continue to deliver an amazing customer experience.""",https://gapsystudio.com/,https://clutch.co/profile/gapsy-studio
Brand Vision,Web Design,Award-Winning Marketing & Web Design Agency,5.0,44 REVIEWS,No,"$10,000+",$100 - $149 / hr,10 - 49,"Toronto, Canada","Web Design,Web Development,Branding,Search Engine Optimization,UX/UI Design","50,20,10,10,10","""I am very satisfied with their taste and style of design and communication.""",https://www.brandvm.com/?utm_source=clutch.co&utm_medium=referral&utm_campaign=web-designers,https://clutch.co/profile/brand-vision-1
Studio Simpatico,Web Design,"Consultative, collaborative, creative",5.0,33 REVIEWS,No,"$25,000+",$150 - $199 / hr,2 - 9,"New York, NY","Web Design,Web Development,UX/UI Design","45,45,10","""They've demonstrated a level of confidence that makes us feel comfortable that we are in good hands.""",http://studiosimpati.co/?utm_source=clutch.co&utm_medium=listing&utm_campaign=directory_listing,https://clutch.co/profile/studio-simpatico
Hooked On Code,Web Design,CUTTING THE BULLSHIT OUT OF WEB DESIGN,5.0,22 REVIEWS,No,"$10,000+",$150 - $199 / hr,2 - 9,"Dallas, TX","Web Design,Web Development","80,20","""The contact and communication have been absolutely amazing.""",https://hookedoncode.com/?utm_source=clutch.co&utm_medium=referral&utm_campaign=directory,https://clutch.co/profile/hooked-code
Salt Technologies,Web Design,⭐️⭐️⭐️⭐️⭐️ Top Rated Web Development Company,4.9,30 REVIEWS,No,"$5,000+",$25 - $49 / hr,10 - 49,"Austin, TX","Web Design,Web Development","50,50","""I warmly recommend working with Salttechno on all your online presence needs.""",https://www.salttechno.com/?utm_source=clutch.co&utm_medium=referral&utm_campaign=directory,https://clutch.co/profile/salt-technologies
Interactive Strategies,Web Design,"Full Service Digital Design, Dev & Marketing",4.9,22 REVIEWS,No,"$100,000+",$150 - $199 / hr,50 - 249,"Washington, DC","Web Design,Web Development,Email Marketing,Pay Per Click,Search Engine Optimization,Social Media Marketing","40,40,5,5,5,5",“They constantly referred back to the research to ensure we built a site our donors wanted to see.”,http://www.interactivestrategies.com/?utm_source=clutch.co&utm_medium=referral&utm_campaign=directory,https://clutch.co/profile/interactive-strategies
Workshop Built,Web Design,Unleash your digital brand potential,4.9,9 REVIEWS,No,"$25,000+",$150 - $199 / hr,10 - 49,"Carlsbad, CA","Web Design,Branding","50,50","""They were knowledgeable, had great creative ideas, and worked hard to understand our needs and vision.""",http://www.workshopbuilt.com/?utm_source=clutch.co&utm_medium=referral&utm_campaign=directory,https://clutch.co/profile/workshop-built
Mojo Media,Web Design,Turn Your Website Into a 24/7 Salesperson,4.9,30 REVIEWS,No,"$1,000+",$50 - $99 / hr,10 - 49,"Toronto, Canada","Web Design,Web Development","90,10","""I had high expectations for the new website but they surpassed all my expectations.""",https://mojo-agency.com/?utm_source=clutch.co&utm_medium=referral&utm_campaign=directory,https://clutch.co/profile/mojo-media-0
Alpha Efficiency,Web Design,Make It. Web development & Hubspot Solutions,5.0,22 REVIEWS,No,"$10,000+",$150 - $199 / hr,10 - 49,"Chicago, IL","Web Design,Web Development,Custom Software Development","45,45,10","''Their team is very knowledgeable, and their practices have been successful.''",https://alphaefficiency.com/?utm_source=clutch.co&utm_medium=referral&utm_campaign=directory,https://clutch.co/profile/alpha-efficiency
Three29 Web Design & Development,Web Design,"Award Winning Web Design, Development, & Marketing",4.9,14 REVIEWS,No,"$5,000+",$150 - $199 / hr,10 - 49,"Roseville, CA","Web Design,Web Development,Pay Per Click,Social Media Marketing","40,40,10,10",“Three29 has been a wonderful partner.”,https://three29.com/?utm_source=clutch.co&utm_medium=referral&utm_campaign=directory,https://clutch.co/profile/three29-web-design-development
ThrillX,Web Design,We create conversion focused websites,4.9,9 REVIEWS,No,"$1,000+",$50 - $99 / hr,2 - 9,"Toronto, Canada","Web Design,Web Development,Branding,Conversion Optimization,UX/UI Design","60,25,5,5,5","""I was blown away by their creativity as well as attention to detail.""",https://thrillxdesign.com/?utm_source=clutch.co&utm_medium=referral&utm_campaign=directory,https://clutch.co/profile/thrillx
Baunfire,Web Design,A Silicon Valley Agency | B2B Marketing Websites,4.9,22 REVIEWS,No,"$75,000+",$150 - $199 / hr,10 - 49,"San Jose, CA","Web Design,Web Development,Branding,Digital Strategy","40,30,15,15",“They’re confident about themselves and have the professionalism and the right processes in place.”,https://www.baunfire.com/?utm_source=clutch.co&utm_medium=referral&utm_campaign=directory,https://clutch.co/profile/baunfire
Xfive,Web Design,Delivering Digital Products since 2005,5.0,42 REVIEWS,No,"$10,000+",$50 - $99 / hr,50 - 249,"Kraków, Poland","Web Design,Web Development,E-Commerce Development","25,50,25",“They go above and beyond in terms of their deliverables.”,https://www.xfive.co/partners/clutch/?utm_source=clutch.co&utm_medium=referral,https://clutch.co/profile/xfive
Teko,Web Design,Award-Winning Digital Agency - Australia,5.0,22 REVIEWS,No,"$10,000+",$100 - $149 / hr,2 - 9,"North Sydney, Australia","Web Design,UX/UI Design,Web Development","70,20,10","""Nathan and the team took the time to understand our business, our target market, and digital ambitions.""",http://www.teko.com.au/?utm_source=clutch.co&utm_medium=referral&utm_campaign=directory,https://clutch.co/profile/teko
VALMAX DIGITAL,Web Design,WEB UI/UX DESIGN | WEB DEVELOPMENT | BRANDING |,5.0,32 REVIEWS,No,"$1,000+",$25 - $49 / hr,10 - 49,"Odesa, Ukraine","Web Design,Web Development,Branding,UX/UI Design","50,20,15,15","""They clearly understand our requirements.""",https://valmaxdigital.com.ua/?utm_source=clutch.co&utm_medium=referral&utm_campaign=profile,https://clutch.co/profile/valmax-digital
XWP,Web Design,Building a better web at enterprise scale,4.9,30 REVIEWS,No,"$50,000+",$150 - $199 / hr,50 - 249,"Chelsea, Australia","Web Design,Web Development,UX/UI Design","25,60,15",“We have a true partnership with them; we work on and solve problems together.”,https://xwp.co/?utm_source=clutch.co&utm_medium=referral&utm_campaign=directory,https://clutch.co/profile/xwp
Optimum7,Web Design,Award Winning Web Development and Marketing Agency,4.6,26 REVIEWS,No,"$1,000+",$100 - $149 / hr,50 - 249,"Coral Gables, FL","Web Design,E-Commerce Development,Search Engine Optimization,Web Development,Custom Software Development","40,20,15,15,10","""We found their work to be exceptional.""",https://www.optimum7.com/top-ranked-web-development-and-design-agency-by-clutch/?utm_source=clutch.co&utm_medium=referral&utm_campaign=web-designers,https://clutch.co/profile/optimum7
Bird Marketing,Web Design,Award Winning Digital Agency,5.0,43 REVIEWS,No,"$5,000+",$100 - $149 / hr,10 - 49,"London, United Kingdom","Web Design,Search Engine Optimization","50,50","""Everything was fantastic.""",https://bird.co.uk/?utm_source=clutch.co&utm_medium=referral&utm_campaign=directory,https://clutch.co/profile/bird-marketing
UPQODE,Web Design,"⭐️⭐️⭐️⭐️⭐️ UI/UX Design Agency,Web Design&Branding",4.9,65 REVIEWS,No,"$5,000+",$100 - $149 / hr,50 - 249,"Nashville, TN","Web Design,Web Development,Content Writing Services,Mobile App Development,Pay Per Click,Search Engine Optimization","35,25,10,10,10,10","""The most impressive thing about UPQODE's team is their efficiency and confidence in leading a project.""",https://www.upqode.com/?utm_source=clutch.co&utm_medium=referral&utm_campaign=web-designers,https://clutch.co/profile/upqode
Visions Design,Web Design,Creating Meaningful Digital Experiences,5.0,44 REVIEWS,No,"$5,000+",$50 - $99 / hr,10 - 49,"Lymm , United Kingdom","Web Design,Web Development,Branding","35,35,30","""Their ability to integrate our brand and vision into the website was exceptional.""",https://visionsdesign.co.uk/,https://clutch.co/profile/visions-design-0
The Sher Agency,Web Design,Exceptional Web Design & Development,5.0,29 REVIEWS,No,"$10,000+",$100 - $149 / hr,2 - 9,"Tucson, AZ","Web Design,Web Development","50,50","""I was very impressed by just how timely and thorough they were throughout the process.""",https://sheragency.com/clutch/?utm_source=clutch&utm_medium=profile&utm_campaign=profile,https://clutch.co/profile/sher-agency
Elevation,Web Design,Full-Service Agency Specializing in Nonprofits,4.8,16 REVIEWS,No,"$10,000+",$150 - $199 / hr,10 - 49,"Washington, DC","Web Design,Branding,Content Marketing,Pay Per Click,Search Engine Optimization,Social Media Marketing","40,20,10,10,10,10","""They were very transparent about costs and helped us to find clever, alternative options to meet our needs.""",https://www.elevationweb.org/,https://clutch.co/profile/elevation
Design In DC,Web Design,A Digital Agency For The Future,4.8,40 REVIEWS,No,"$10,000+",$150 - $199 / hr,10 - 49,"Washington, DC","Web Design,Web Development,Advertising,Branding,Search Engine Optimization","40,30,10,10,10",''They surpassed any other web development firm that I've worked with in the past.'',https://designindc.com/?utm_source=clutch.co&utm_medium=referral&utm_campaign=directory,https://clutch.co/profile/design-dc
Reactive,Web Design,Award-winning London web design & brand agency,4.9,12 REVIEWS,No,"$5,000+",$50 - $99 / hr,2 - 9,"London, United Kingdom","Web Design,Branding,Other Digital Marketing","80,10,10","""They had real B2B marketing and web design knowledge and quickly understood the new website's needs and priorities.""",https://www.web-designlondon.co.uk/?utm_source=clutch.co&utm_medium=referral&utm_campaign=directory,https://clutch.co/profile/reactive-1
ControlF5,Web Design,Refresh Your Web Experience,4.8,48 REVIEWS,No,"$10,000+",$25 - $49 / hr,10 - 49,"Indore, India","Web Design,E-Commerce Development","50,50","“Controlf5 has a very efficient, responsive, and timely team.”",https://www.controlf5.in/?utm_source=clutch.co&utm_medium=referral&utm_campaign=directory,https://clutch.co/profile/controlf5
League Design Agency,Web Design,True value in uniqueness,5.0,88 REVIEWS,No,"$10,000+",$25 - $49 / hr,10 - 49,"Kyiv, Ukraine","Web Design,UX/UI Design,Graphic Design","30,40,30","""I loved their professionalism and how they thought outside the box to solve a problem.""",https://www.league.design/?utm_source=clutch.co&utm_medium=referral,https://clutch.co/profile/league-design-agency
Trajectory Web Design,Web Design,A web design company that's light-years ahead,4.9,18 REVIEWS,No,"$10,000+",$150 - $199 / hr,2 - 9,"Atlanta, GA","Web Design,Digital Strategy,Content Marketing,Pay Per Click,Search Engine Optimization","55,15,10,10,10","""Josh was great to work with.""",https://www.trajectorywebdesign.com/?utm_source=clutch.co&utm_medium=referral&utm_campaign=web-designers,https://clutch.co/profile/trajectory-web-design
Brandcoders,Web Design,Think Beyond the Ordinary™,5.0,12 REVIEWS,No,"$10,000+",$150 - $199 / hr,10 - 49,"Orlando, FL","Web Design,Branding,Search Engine Optimization,UX/UI Design,Custom Software Development,Web Development","60,10,10,10,5,5","""Their portfolio of work and customer service blew us away.""",https://brandcoders.com/?utm_source=clutch.co&utm_medium=referral&utm_campaign=web-designers,https://clutch.co/profile/brandcoders
EnlightWorks,Web Design,Web Design & Digital Marketing,4.9,13 REVIEWS,No,"$1,000+",$100 - $149 / hr,2 - 9,"Benicia, CA","Web Design,Search Engine Optimization,Web Development","70,20,10","""EnlightWorks has been great to work with and timely in their work.""",https://www.enlightworks.com/?utm_source=clutch.co&utm_medium=referral&utm_campaign=web-designers,https://clutch.co/profile/enlightworks
Harley Oliver,Web Design,Premium Digital Design – Now booking 2023,5.0,13 REVIEWS,No,"$10,000+",$100 - $149 / hr,2 - 9,"Toronto, Canada","Web Design,E-Commerce Development,Branding,UX/UI Design,Web Development","50,20,10,10,10","""Harley Oliver did an excellent job.""",https://www.harleyoliver.com/?utm_source=clutch.co&utm_medium=referral&utm_campaign=web-designers,https://clutch.co/profile/harley-oliver
Techuz,Web Design,Delivering Promises,4.9,34 REVIEWS,No,"$5,000+",< $25 / hr,10 - 49,"Ahmedabad, India","Web Design,Web Development,Custom Software Development","40,50,10",“They respond well to feedback and make changes to ensure you get exactly what you want.”,https://www.techuz.com/?utm_source=clutch.co&utm_medium=referral&utm_campaign=profiepage,https://clutch.co/profile/techuz
Halo Lab,Web Design,✨ 10 YEARS OF DESIGN-DRIVEN PRODUCT DEVELOPMENT ✨,4.9,75 REVIEWS,No,"$5,000+",$25 - $49 / hr,50 - 249,"Sharjah, United Arab Emirates","Web Design,Web Development,UX/UI Design","20,60,20","""Their speed and design capabilities were impressive.""",https://halo-lab.com/?utm_source=clutch.co&utm_medium=referral&utm_campaign=web-designers,https://clutch.co/profile/halo-lab
Orbit Media Studios,Web Design,Award winning web design and development company.,4.9,16 REVIEWS,No,"$50,000+",$150 - $199 / hr,10 - 49,"Chicago, IL","Web Design,Web Development,E-Commerce Development","50,40,10","""Orbit Media Studios' project management was phenomenal!""",https://www.orbitmedia.com/?utm_source=clutch.co&utm_medium=referral&utm_campaign=directory,https://clutch.co/profile/orbit-media-studios
Vardot,Web Design,Enterprise Drupal Solutions,4.9,50 REVIEWS,No,"$25,000+",$100 - $149 / hr,50 - 249,"Santa Clara, CA","Web Design,Web Development,Enterprise App Modernization,UX/UI Design","20,60,10,10","""We felt like we were working with a true partner rather than a vendor.""",https://vardot.com/?utm_source=clutch.co&utm_medium=referral&utm_campaign=web-designers,https://clutch.co/profile/vardot
Digital Nomads HQ,Web Design,Digital Marketing Agency & SEO Specialists,5.0,42 REVIEWS,No,"$1,000+",$100 - $149 / hr,10 - 49,"Mooloolaba, Australia","Web Design,Search Engine Optimization,Pay Per Click,Social Media Marketing","30,50,10,10","""The team at Digital Nomads are the most down-to-earth, engaging people who are smart as a whip.""",https://digitalnomadshq.com.au/?utm_source=clutch.co&utm_medium=referral&utm_campaign=directory,https://clutch.co/profile/digital-nomads-hq
The Media Captain,Web Design,Digital Agency in Columbus.,4.9,30 REVIEWS,No,"$1,000+",$100 - $149 / hr,10 - 49,"Columbus, OH","Web Design,Pay Per Click,Search Engine Optimization,Advertising,Social Media Marketing,Web Development,Public Relations","35,15,15,10,10,10,5","""The fact that they own and operate their own e-commerce site shows me they know firsthand what works.""",https://www.themediacaptain.com/?utm_source=clutch.co&utm_medium=referral&utm_campaign=directory,https://clutch.co/profile/media-captain
Weberous,Web Design,Business driven web design.,5.0,5 REVIEWS,No,"$25,000+",$100 - $149 / hr,2 - 9,"Los Angeles, CA","Web Design,Search Engine Optimization,Marketing Strategy,Web Development,Branding,Social Media Marketing","55,15,10,10,5,5","""Weberous took the fuss out of our process by 100% ... It's a huge relief for us to have our system in place.""",http://www.weberous.com/?utm_source=clutch.co&utm_medium=referral&utm_campaign=directory,https://clutch.co/profile/weberous
Buzzworthy Studio,Web Design,Creative Web Design Company NYC,5.0,19 REVIEWS,No,"$25,000+",$150 - $199 / hr,10 - 49,"Brooklyn, NY","Web Design,Web Development,Search Engine Optimization","50,40,10","""They are friendly, engaging, and excellent at what they do.""",https://buzzworthystudio.com/,https://clutch.co/profile/buzzworthy-studio
RivalMind,Web Design,We Exist to Help Companies Thrive.,5.0,35 REVIEWS,No,"$1,000+",$150 - $199 / hr,10 - 49,"St. Charles, IL","Web Design,Search Engine Optimization,Social Media Marketing","40,50,10","""They’re highly proactive when it comes to urgent matters, which is always highly appreciated.""",https://www.rivalmind.com/web-design-company/?utm_source=clutch.co&utm_medium=referral&utm_campaign=web-designers,https://clutch.co/profile/rivalmind
Savage Global Marketing,Web Design,We help brands save time and make more money.,4.8,54 REVIEWS,No,"$5,000+",$150 - $199 / hr,10 - 49,"Fort Lauderdale, FL","Web Design,Pay Per Click,Social Media Marketing,Video Production","30,50,10,10","""Their level of professionalism and knowledge about the latest changes in social media is impressive.""",https://www.savageglobalmarketing.com/contact-us/clutch/?utm_source=clutch.co&utm_medium=referral&utm_campaign=directory,https://clutch.co/profile/savage-global-marketing
Storm Brain,Web Design,💡 Smarter Digital – Marketing & Web Assets,5.0,102 REVIEWS,No,"$5,000+",$150 - $199 / hr,10 - 49,"Carlsbad, CA","Web Design,E-Commerce Development,Web Development,Digital Strategy,Search Engine Optimization","25,30,25,10,10",“We’re most impressed with Storm Brain’s excellent communication.”,https://www.stormbrain.com/?utm_source=clutch.co&utm_medium=referral,https://clutch.co/profile/storm-brain
Netguru,Web Design,Building digital solutions for world changers,4.8,51 REVIEWS,No,"$25,000+",$50 - $99 / hr,250 - 999,"Poznań, Poland","Web Design,Mobile App Development,Web Development,BI & Big Data Consulting & SI,Cloud Consulting & SI","10,35,35,10,10","""Netguru’s biggest strength is their people-first approach.""",https://netguru.com/clutch/?utm_source=clutch.co&utm_medium=referral&utm_campaign=web-designers,https://clutch.co/profile/netguru
Leo9 Studio,Web Design,"We Design, Digitize, & Grow Your Business.",4.9,24 REVIEWS,No,"$5,000+",$25 - $49 / hr,10 - 49,"Mumbai, India","Web Design,UX/UI Design,Branding","40,35,25","""They gave us a professional site that's easy to update.""",http://www.leo9studio.com/?utm_source=clutch.co&utm_medium=referral&utm_campaign=directory,https://clutch.co/profile/leo9-studio
